6,NAME THE IDEAL AGE FOR A US PRESIDENT,91,-1,-1,50,24,45,21,55,18,60,15,40,12,35,9
6,NAME SOMETHING THAT MELTS,98,60,90,ICE+CREAM,29,BUTTER,24,CHEESE,21,SNOW*,18,WAX/CANDLE,13,CHOCOLATE,9
6,NAME SOMETHING YOU EAT THAT'S RED,90,56,84,APPLE,27,TOMATO,24,CHERRY,21,BEETS,18,(CATS/KETCH)UP,15,JELLO/GELATIN,10
8,HOW MANY YEARS DOES A WRISTWATCH LAST,100,-1,-1,10,28,5,25,3,22,2,19,4,16,20,13,6,10,1,7
10,NAME AN UNUSUAL PET,92,78,117,SNAKE,38,SKUNK,35,MONKEY/CHIMP,32,[ALlI]GATOR/CROCODILE,28,TARANTULA,20,RACCOON,17,OCELOT,14,LION,11,BEAR,8,ROCK,5
11,HOW MANY YEARS DOES A DOG LIVE,97,-1,-1,10,34,15,31,12,28,14,25,8,22,11,19,20,16,7,13,13,10,5,7,3,4
8,NAME A FLAVOR OF HARD CANDY,97,84,126,[PEPPER]MINT,41,CHERRY,36,LEMON,33,BUT[[']/TE]RSCOTCH,30,GRAPE,22,CHOCOLATE,19,CINNAMON,16,(ROOT/BIRCH)+BEER,13
6,NAME A VEHICLE WITH VERY LARGE WHEELS,93,62,93,TRACTOR,30,TRUCK,27,BULLDOZER,24,[AIR]PLANE,21,BUS,16,[DUNE+]BUGGY,13
6,NAME SOMETHING A ROOF IS MADE OF,96,54,81,SHINGLES/WOOD,26,ASPHALT/TAR,22,SLATE,18,TILE,15,TIN,12,ASBESTOS,9
4,"NAME SOMETHING PEOPLE WEAR THAT BEGINS WITH THE LETTER ""S""",97,54,81,SHIRT,26,SHOEs,23,SWEATER,18,SO(CKs/X),15
10,NAME THE CARD GAME YOU PLAY BEST,94,88,132,POKER,43,GIN[+RUMMY]/RUMMY,40,BRIDGE,32,PINOCHLE,29,UNO,26,BLACKJACK/TWENTY+ONE,23,CANASTA,17,CRIBBAGE,14,SOLITAIRE/PATIENCE,11,HeARTS,7
9,NAME A FABRIC MEN'S SUITS ARE MADE OF,94,62,93,WOOL,30,POLYESTER,27,TWEED,24,GABARDINE,21,SILK,18,COTTON,15,FLANNEL,12,MOHAIR,9,SERGE,6
11,NAME A FOOD THAT TASTES TERRIBLE COLD,88,90,135,POTATO[ES],44,EGGs,39,SOUP,34,PIZZA,31,SPAGHETTI,28,OATMEAL,25,STEAK,22,[HAM]BURGERs,19,CHILI,10,COFFEE,7,GRAVY,4
7,NAME THE SPEED IN MPH AT WHICH YOU DRIVE ON DESERTED HIGHWAYS,98,-1,-1,65,26,70,23,60,20,55,17,80,14,75,11,85,8
8,NAME A TYPE OF STORE THAT DELIVERS,97,102,153,FURNITURE,50,DRUG/PHARMACY,47,GROCERY/[SUPER+]MARKET,43,PIZZA,35,DEPARTMENT,32,FLO(RIST/WER[+SHOP]),29,[DRY+]CLEANERs,20,APPLIANCE,7
5,NAME A HOLIDAY WHEN YOU EAT TOO MANY SWEETS,100,86,129,(CHRIST/X+)MAS,42,EASTER,35,HALLOWEEN,32,VALENTINE[[']S][+DAY],29,THANKSGIVING,10
7,NAME THE MOST POPULAR BREED OF DOG,93,106,159,[FRENCH+]POODLE,52,[GER[MAN]+]SHEPHERD,45,COLLIE,34,[COCKER+]SPANIEL,31,DALMATIAN,24,S[AIN]T+BERNARD,21,SCOT(TIE/CH+TERRIER),12
6,NAME SOMETHING THAT MAKES A LOUD BANG,98,94,141,GUN/CANNON/PISTOL/RIFLE,46,FIRE(WORKS/CRACKER),40,[AIR]PLANE/SONIC+BOOM,35,BALLOON[+BURST[ING]],27,BACKFIRE/CAR/AUTO*,16,THUNDER,9
7,NAME A FOREIGN MONEY,94,54,81,PESO,26,FRANC,23,MARK,20,LIRA,17,POUND,14,SHILLING,11,PESETA,8
11,NAME A CITY WITH A PRO BASKETBALL TEAM,95,110,165,LOS+ANGELES/LA,54,NEW+YORK/NY,48,PHILA[DELPHIA],42,BOSTON,37,CHICAGO,34,KANSAS+CITY/KC,31,ATLANTA,25,FRISCO/SAN+FRANCISCO,22,SEATTLE,16,HOUSTON,13,S[AIN]T+LOUIS,10
8,NAME SOMETHING MADE OF RUBBER,93,68,102,TIRE,33,BALL,30,[RUBBER+]BAND,27,BOOTS/GALOSHES,20,ELASTIC,16,GLOVES,13,HOSE,10,NIPPLES,7
11,NAME A FOOD SERVED WITH TEA,93,108,162,COOKIEs,53,CRUMPETs,48,CAKEs,43,TOAST,38,CRACKERs,35,SANDWICH,30,BISCUITs,27,CHICKEN,22,DO[UGH]NUTs,19,LEMON,10,CHOW+MEIN/CHINESE,7
8,NAME THE AGE WHEN GIRLS START KEEPING DIARIES,99,-1,-1,12,28,13,25,10,22,14,19,15,16,11,13,16,10,9,7
5,NAME SOMETHING BEES DO,98,54,81,MAKE+HONEY,26,STING,21,BUZZ,18,MAKE+WAX,15,POLLENATE,10
4,NAME A SCANDINAVIAN COUNTRY,100,42,63,SWEDEN,20,NORWAY,17,DENMARK,14,FINLAND,11
5,NAME A PART OF A FISH,98,46,69,FIN,22,GILL,19,HEAD,16,TAIL,13,SCALES,10
9,NAME THE ONE APPLIANCE IN YOUR HOME THAT YOU'D HATE TO BE WITHOUT,95,94,141,FRIDGE/REFRIGERATOR/ICEBOX,46,STOVE/OVEN/MICROWAVE/RANGE,41,WASH(ER/ING+MACHINE),35,DISHWASHER,28,TV[+SET]/TELEVISION,25,TOASTER,17,CAN+OPENER,14,COFFEEPOT,9,VACUUM,6
11,HOW MANY YEARS DOES A BED LAST,95,-1,-1,10,34,20,31,15,28,25,25,30,22,5,19,50,16,100,13,8,10,35,7,40,4
6,"HOW MANY NIGHTS A WEEK DO YOU STAY UP FOR ""THE TONIGHT SHOW""",98,-1,-1,0,24,2,21,3,18,1,15,5,12,4,9
7,NAME SOMETHING A HAIRDRESSER USES,99,88,132,COMB,43,[HAIR+]SPRAY,40,[HAIR+]BRUSH,33,ROLLERS/CURLERS,26,[HAIR+/BLOW+]DRYER,22,SHAMPOO,12,SCISSORS/SHEARS,9
6,NAME THE CAPITAL OF A FOREIGN COUNTRY,88,52,78,PARIS,25,ROME,22,LONDON,19,MOSCOW,16,BERLIN,13,BEIJING/PEKING,10
6,NAME A FOOD YOU BUY SMOKED,99,58,87,FISH/SALMON,28,HAM,24,SAUSAGE,21,BACON,18,BEEF+JERKY/BEEF,15,OYSTERS,9
4,NAME ONE OF THE BLANKS ON A BLANK CHECK,99,44,66,DATE,21,PAYEE,18,AMOUNT,15,SIGNATURE/NAME,12
8,HOW MANY HOURS A DAY DOES THE AVERAGE AMERICAN WATCH TV,100,-1,-1,4,28,5,25,3,22,6,19,8,16,2,13,7,10,10,7
6,NAME SOMETHING YOU'D LIKE TO OWN BUT COULD NOT AFFORD THE UPKEEP,94,88,132,BOAT/YA[CH]T,43,HO(USE/ME),37,CAR/[COR]VET[TE]/BMW/FERRARI/AUTO*,32,HORSE,17,POOL,14,[AIR]PLANE,11
5,"GIVE ME ANOTHER WORD FOR ""ZERO""",82,48,72,NOTHING/NADA,23,ZILCH,19,NONE,16,ZIP,13,NULL,10
9,AT WHAT AGE DO MOST MEN MARRY,98,-1,-1,25,30,22,27,21,24,23,21,24,18,30,15,20,12,26,9,28,6
6,NAME A COLOR OF POSTAGE STAMPS,99,50,75,BLUE,24,WHITE,21,PURPLE,18,RED,15,GREEN,12,BROWN,9
11,HOW MANY HOUSES ARE THERE ON A KID'S PAPER ROUTE,96,-1,-1,50,34,100,31,25,28,75,25,20,22,40,19,30,16,15,13,35,10,150,7,60,4
5,NAME A MAKE OF CAR YOU SEE TELEPHONES IN,100,54,81,ROLLS+ROYCE,26,CADILLAC,21,LINCOLN,18,MERCEDES,15,CHEV(ROLET/Y),12
10,NAME A WELL-KNOWN INSURANCE COMPANY,93,104,156,PRUDENTIAL,51,ALLSTATE,48,STATE+FARM,45,MUTUAL/OMAHA,40,J[OHN]+HANCOCK,36,MET(+LIFE/ROPOLITAN),27,BLUE+(CROSS/SHIELD),20,HARTFORD,11,NATIONWIDE,8,LLOYDS,5
7,NAME SOMETHING THAT HAS A SPRING INSIDE IT,98,106,159,BED/MATTRESS/BOXSPRING,52,CLOCK/WATCH,47,PEN,43,CHAIR,40,GUN,37,JACK+IN+[THE+]BOX,34,COUCH/SOFA,9
7,NAME A FRUIT TREE,97,54,81,APPLE,26,PEACH,23,CHERRY,20,ORANGE,17,LEMON,14,PLUM,11,PEAR,8
7,NAME AN ANIMAL BOYS SCARE GIRLS WITH,100,58,87,FROG/TOAD,28,SNAKE,24,MOUSE/MICE,21,SPIDER,17,WORM,14,LIZARD,11,RAT,8
7,NAME SOMETHING MADE OF WIRE,89,70,105,FENCE,34,[COAT+]HANGER,31,CORDS,24,CAGE/PEN/KENNEL,21,BRACES,16,EARRINGs,13,SCREEN,8
5,NAME A VEGETABLE YOU BAKE,97,60,90,POTATO[ES],29,SQUASH/ZUCCHINI,24,BEANs,20,CARROTs,15,BROCCOLI,10
6,NAME AN OCCASION WHEN PEOPLE EAT AND DRINK TOO MUCH,99,70,105,NEW+YEARs,34,THANKSGIVING,25,(CHRIST/X+)MAS,22,WEDDING,15,PARTY,12,BIRTHDAY,9
11,NAME A BIRD THAT DOES NOT FLY,94,70,105,OSTRICH,34,PENGUIN,31,JAILBIRD,28,CHICKEN,25,ROADRUNNER,22,THUNDERBIRD,19,DODO,16,EMU,13,PARROT,10,SWAN,7,TURKEY,4
4,NAME YOUR FAVORITE SUMMERTIME BEVERAGE,89,64,96,ICED+TEA,31,LEMONADE,26,SODA[+POP]/POP/COKE/PEPSI,23,KOOL+AID,13
10,NAME THE COLOR OF YOUR LIVING ROOM CARPET,99,72,108,GREEN,35,BROWN,32,GOLD,29,BEIGE/TAN,26,RUST,22,BLUE,19,RED,16,GR(A/E)Y,13,ORANGE,8,YELLOW,5
8,NAME A BREED OF LARGE DOG,96,106,159,S[AIN]T+BERNARD,52,[GER[MAN]+]SHEPHERD,43,GREAT+DANE,32,COLLIE,27,AFG[H]AN,24,DOBERMAN,19,GR(E/A)YHOUND,16,[IRISH+]SETTER,11
4,NAME SOMETHING PEOPLE PUT ON HOT CEREAL,99,42,63,SUGAR,20,MILK,17,BUTTER,14,CREAM,11
6,NAME SOMETHING YOU DO TO A HORSE,97,54,81,RIDE,26,BRUSH/CURRY/GROOM,23,FEED,18,SHOE,15,KICK,12,SADDLE,9
4,NAME A JOB ON A NEWSPAPER,97,54,81,(REPOR/WRI)TER,26,EDITOR,21,(TYPESET/PRIN)TER,18,PHOTOGRAPH(Y/ER),13
7,NAME SOMETHING THAT'S EASIER TO GET INTO THAN IT IS TO GET OUT OF,76,82,123,TROUBLE,40,[SMALL+]CAR/AUTO*,37,MARRIAGE,27,BED,24,BOOTS,21,A LIE/[A+]LIE,18,TIGHT+PANTS,10
4,NAME SOMETHING THAT SWINGS BACK AND FORTH,94,50,75,PENDULUM,24,SWING,21,[SWINGING+]DOOR,18,HAMMOCK,11
5,NAME A FRUIT YOU EAT WITH BREAKFAST,98,58,87,BANANAs,28,GRAPEFRUIT,23,ORANGEs,20,STRAWBERR(Y/IES),15,MELON,10
4,NAME A PLACE PEOPLE KEEP IMPORTANT PAPERS,93,120,180,VAULT/[SAFE[TY]+]DEPOSIT+BOX,59,SAFE/STRONGBOX,37,DESK[+DRAWER]/DRAWER,33,FIL(E/ING)+CAB[INET],25
6,"GIVE ME ANOTHER WORD FOR ""BIG""",97,50,75,LARGE,24,HUGE,21,GIGANTIC,18,GIANT,15,ENORMOUS,12,HUMONGOUS,9
5,NAME A COLOR OF INK,100,48,72,BLUE,23,BLACK,20,RED,17,GREEN,14,PURPLE/VIOLET,11
7,"NAME SOMETHING THAT'S ""YOURS"" AT HOME AND YOU GET UPSET WHEN OTHERS USE IT",84,76,114,[TOOTH+]BRUSH,37,BED,30,[HAIR+]BRUSH,27,COMB,20,TOWEL,17,CAR/AUTO*,14,DEODORANT,8
5,NAME A MAJOR HOME REPAIR,92,68,102,ROOF,33,PLUMBING/* PLUMBING/[* ]PIPES/FAUCET,30,HEATING/FURNACE,18,PAINTING,14,ELECTRICAL/WIRING,11
5,NAME A JOB IN WHICH WOMEN COMPLAIN THAT MEN ARE ALWAYS MAKING PASSES,93,52,78,SECRETARY/OFFICE/CLERICAL,25,WAITRESS,20,NURSING,17,MODELS,14,STEWARDESS/AIRLINE,11
4,NAME A COUNTRY THAT WAS ONCE AMERICA'S BITTER ENEMY BUT IS NOW HER FRIEND,97,60,90,ENGLAND/[GREAT+]BRITAIN/UNITED+KINGDOM/UK,29,JAPAN,17,CHINA,14,GERMANY,11
5,NAME SOMETHING YOU GIVE THANKS FOR IN YOUR PRAYERS,91,48,72,FAMILY/RELATIVES,23,HEALTH,19,LIFE,16,FRIENDS,13,EACH DAY,10
5,NAME SOMETHING MOST WOMEN ENJOY DOING THAT MOST MEN DON'T CARE FOR AT ALL,79,50,75,SHOPPING,24,SEWING/KNITTING,21,TALKING/GOSSIP,17,COOKING,13,DANCING,10
6,NAME SOMETHING YOU TRIED TO FIX BUT HAD TO CALL A REPAIRMAN LATER,89,70,105,TV[+SET]/TELEVISION,34,CAR/AUTO*,26,PLUMBING/FAUCET/PIPES,20,RADIO,15,CLOCK,12,TOASTER,9
6,NAME SOMETHING YOU SEE IN A LANDSCAPE PAINTING,89,56,84,TREES,27,MOUNTAINS/HILLS,24,SKY,20,GRASS/FIELD,17,BUSHES/SHRUBS,13,SUNSET,9
7,HOW MANY HOURS DOES A HEADACHE LAST,95,-1,-1,2,26,1,23,3,20,24,17,4,14,5,11,12,8
6,NAME A CIRCUS ANIMAL,97,52,78,LION,25,TIGER,22,ELEPHANT,19,MONKEY/APE,16,BEAR,12,HORSE,9
6,NAME SOMETHING YOU EAT TOO MUCH OF AND GET SICK,81,56,84,CANDY/SWEETS,27,ICE+CREAM,23,CAKE,18,PEANUTS,15,SPAGHETTI,12,TURKEY,9
4,NAME SOMETHING YOU PUT ON A CUT,96,54,81,BAND(AGE/+AID),26,IODINE,19,PEROXIDE,16,ME[R]THIOLATE,13
5,NAME A TYPE OF PLACE WHERE PEOPLE CAN KISS IN PUBLIC AND NO ONE NOTICES,81,100,150,TERMINAL/AIRPORT/[TRAIN+/BUS+](STATION/DEPOT),49,[DRIVE+IN+]MOVIE,27,PARK,16,BEACH,13,DISCO,10
5,NAME SOMETHING YOU WORRY ABOUT LOSING,87,50,75,MONEY/WALLET/PURSE,24,HAIR,19,TEETH,16,KEYS,13,WEIGHT,10
5,NAME SOMETHING YOU DRINK LOTS OF,94,60,90,WATER,29,COFFEE,26,TEA,23,SODA[+POP]/COKE/PEPSI/POP,20,MILK,10
3,NAME SOMETHING YOU GET FROM A WELL,100,38,57,WATER,18,OIL,15,WISH,12
6,NAME A NAUGHTY THING CHILDREN DO THAT SHOULD GET THE MOST PUNISHMENT,88,56,84,LIE,27,STEAL,24,TALK+BACK,21,SWEAR/CURSE,16,DISOBEY,12,FIGHT,9
4,NAME SOMETHING THAT MAKES A CRASHING NOISE,86,106,159,BREAK[ING]+(DISH/GLASS),52,[CAR/AUTO*]+ACCIDENT,35,THUNDER[+STORM]/STORM,19,CYMBAL,11
4,"NAME SOMETHING ABOUT WHICH FRIENDS ASK FOR ""YOUR HONEST OPINION""",91,74,111,CLOTHES,36,LOOKS/APPEARANCE,33,[NEW+]HAIRDO/[* ]HAIR*,29,MARRIAGE,11
3,NAME A TYPE OF BOOK THAT CAN BE FOUND IN JUST ABOUT EVERY HOUSEHOLD,94,44,66,BIBLE/* BIBLE,21,COOKBOOK,15,DICTIONARY,12
6,NAME SOMETHING IN NATURE THAT SCARES THE HECK OUT OF YOU,83,86,129,SNAKE,42,LIGHTNING[ *]/ELECTRICAL[ *]/THUNDER[+STORM],39,[WIND]STORM/TORNADO/HURRICANE,22,SPIDER,15,EARTHQUAKE,12,BAT,9
7,BESIDES A STOP SIGN NAME A SIGN ON A CITY STREET,88,78,117,YIELD,38,SPEED+LIMIT,35,ONE+WAY,30,[STREET+]NAME,25,NO+PARKING,18,SLOW,13,BUS+STOP,10
4,"WHO WOULD YOU CROWN AS ""THE WORLD'S GREATEST ALL-TIME ENTERTAINER""",68,82,123,BOB+HOPE,40,ELVIS[+PRESLEY],35,SAMMY+DAVIS[+JR],28,[FRANK+]SINATRA,15
4,NAME SOMETHING PEOPLE USE SEASHELLS TO MAKE,88,46,69,JEWELRY,22,ASH+TRAY,19,LAMPS,14,PLANTERS,11
7,NAME SOMETHING YOU'VE BEEN BITTEN BY,98,60,90,MOSQUITO,29,DOG,26,BEE,23,SPIDER,20,ANT,17,PARROT/BIRD,14,PERSON/BABY/HUMAN,10
5,NAME SOMETHING THAT CAN LOOK SCRAGGLY IF NOT PROPERLY CARED FOR,94,52,78,HAIR/WIG,25,PET/CAT/DOG,21,LAWN,16,BEARD,13,CLOTHES,10
6,NAME A DOOR INSIDE THE HOUSE THAT YOU KEEP SHUT,98,58,87,CLOSET,28,BASEMENT/CELLAR,25,BATHROOM,21,FRIDGE/REFRIGERATOR/ICEBOX,18,BEDROOM,13,CUPBOARD/CABINET,10
8,NAME THE APPLIANCE IN YOUR HOME MOST IN NEED OF REPLACEMENT,91,88,132,TOASTER,43,STOVE/OVEN/RANGE,40,WASH(ER/ING+MACHINE),35,FRIDGE/REFRIGERATOR/ICEBOX,28,TV[+SET]/TELEVISION,23,CAN+OPENER,15,VACUUM,10,DISHWASHER,7
4,NAME A FRUIT THAT SHAMPOOS SMELL LIKE,95,42,63,STRAWBERRY,20,LEMON,17,APPLE,14,APRICOT,11
4,NAME SOMETHING IN WHICH YOU COULD SEE FOOTPRINTS,100,44,66,SNOW,21,SAND,18,MUD/DIRT,15,CEMENT,11
5,NAME A SPORT THAT REALLY CAUGHT ON IN THE LAST FEW YEARS,75,64,96,SOCCER,31,TENNIS,28,RAC(QU/K)ETBALL,25,[ROLLER+/ICE+]SKATING,20,HOCKEY,10
4,NAME A FOOD THAT PREGNANT WOMEN CRAVE,94,46,69,PICKLES,22,ICE+CREAM,19,WATERMELON,14,PIZZA,11
5,NAME A MEAT YOU BUY IN A CAN,87,50,75,HAM,24,SPAM,21,TUNA,18,CHICKEN,15,CORNED+BEEF,12
5,NAME SOMETHING DESIGNED TO HOLD A BABY,93,58,87,CRIB,28,CARRIAGE/STROLLER/PRAM,25,CRADLE,20,CAR+SEAT,17,HIGH+CHAIR,12
6,NAME SOMETHING THAT'S HARD TO SWEEP UP WHEN YOU SPILL IT,87,50,75,SUGAR,24,FLOUR,21,EGGS,18,MILK,15,MERCURY,12,SALT,9
5,NAME SOMETHING THAT GETS TUNED,97,66,99,PIANO,32,CAR/AUTO*/ENGINE,29,RADIO/STEREO,22,GUITAR,18,TV[+SET]/TELEVISION,15
6,NAME A SIGN YOU SEE IN DEPARTMENT STORES,75,54,81,SALE,26,EXIT,23,SHOPLIFTERS,20,NO+SMOKING,17,SHOES,12,ESCALATOR,9
6,NAME SOMETHING YOU SEE ON THE SCREEN BEFORE THE MOVIE STARTS,95,78,117,CREDITS,38,PREVIEW/[COMING+]ATTRACTIONS,35,TITLE,27,CARTOONs,24,ADS/COMMERCIALs,19,[MOVIE+]RATING,13
3,WHERE IS THE DOG'S FAVORITE PLACE TO SLEEP IN THE HOUSE,87,50,75,FURNITURE/CHAIR/SOFA/BED/COUCH,24,FIREPLACE/HEARTH,17,STOVE/HEATER,13
5,NAME A COLOR OF CAKE FROSTING,99,50,75,WHITE/VANILLA,24,BROWN/CHOCOLATE,20,PINK,16,YELLOW,13,BLUE,10
5,NAME A COMPLAINT MANY TENANTS HAVE ABOUT THEIR APARTMENTS,90,84,126,[NOISY/LOUD]+NEIGHBORS/NOIS(E/Y),41,PLUMBING,26,HIGH+RENT,23,NO+HEAT/COLD,18,TOO+SMALL,12
6,"GIVE ANOTHER WORD FOR ""UGLY""",78,50,75,GROSS,24,HOMELY,21,HIDEOUS,18,UNATTRACTIVE,15,REPULSIVE,12,HORRIBLE,9
6,NAME SOMETHING KIDS TAKE WITH THEM WHEN THEY MOVE OUT OF THE HOUSE,95,82,123,CLOTHES,40,STEREO,37,TOYS/STUFFED+ANIMALs,34,FURNITURE,24,TV[+SET]/TELEVISION,21,PETs/DOG/CAT,13
5,NAME A PLACE WHERE SIGNS ARE IN SEVERAL LANGUAGES,86,54,81,AIRPORT/TERMINAL,26,BORDER,22,RESTAURANT,19,BATHROOM,16,UN/UNITED+NATIONS,13
4,NAME A PURCHASE PEOPLE LIKE TO SHOW OFF TO THEIR FRIENDS,97,50,75,CAR/AUTO*,24,CLOTHES,18,JEWELRY/DIAMOND,15,FURNITURE,11
4,NAME SOMETHING A FOOTBALL PLAYER WEARS,99,60,90,HELMET,29,PADS,26,JERSEY,23,[ATHLETIC+]SUPPORTER/JOCK[+STRAP],20
5,NAME A PIECE OF JEWELRY PEOPLE HAVE ENGRAVED,97,46,69,BRACELET,22,RING,19,WATCH,16,LOCKET,13,NECKLACE,10
9,NAME A SPORT THAT REQUIRES SPECIAL SHOES,99,62,93,FOOTBALL,30,BASEBALL,27,TENNIS,24,BOWLING,21,GOLF,18,TRACK,15,BASKETBALL,12,SKATING,9,SOCCER,6
10,NAME A FAST-PACED SPORT,93,126,189,HOCKEY,62,BASKETBALL,59,(CAR/AUTO)+RAC(E/ING)/RAC(ING/E)+CARS,56,TENNIS,32,TRACK,29,SOCCER,26,JAI+ALAI/HILI,23,HANDBALL,17,HORSE+RAC(E/ING),14,FOOTBALL,5
4,NAME A HOLIDAY THAT HAS SPECIAL COLORS ASSOCIATED WITH IT,100,130,195,(CHRIST/X+)MAS,64,VALENTINE[']S[+DAY],57,HALLOWEEN,44,S[AIN]T+PA(DDY/TRICK)s,41
5,NAME A DEVICE USED FOR CUTTING,95,60,90,SCISSORs/SHEARs,29,KNIFE,21,SAW,18,RAZOR,15,LAWN+MOWER,12
8,NAME A DEVICE YOU LOOK THROUGH,88,78,117,TELESCOPE,38,MICROSCOPE,35,BINOCULARS,32,[EYE+]GLASS[ES],29,WINDOW,16,KEYHOLE,13,CAMERA,10,PERISCOPE,7
4,NAME A FAMOUS NEWS MAGAZINE,100,46,69,TIME,22,NEWSWEEK,19,US+NEWS,16,PEOPLE,11
8,NAME A STATE WITH GREAT TOURIST ATTRACTIONS,95,78,117,CALIFORNIA/CA,38,FLORIDA/FL,34,NEW+YORK/NY,30,HAWAII/HI,24,ARIZONA/AZ,20,COLORADO/CO,16,NEVADA/NV,12,MAINE/ME,8
5,NAME A FLAVOR OF JELLY,96,50,75,STRAWBERRY,24,GRAPE,21,CHERRY,18,RASpBERRY,15,BLUEBERRY,10
5,NAME THE BEST SEASON OF THE YEAR,100,56,84,SUMMER,27,SPRING,24,FALL/AUTUMN,21,WINTER,17,(CHRIST/X+)MAS,14
5,NAME THE QUIETEST PLACE IN YOUR HOUSE,98,50,75,BEDROOM,24,BATHROOM,21,BASEMENT/CELLAR,18,DEN/STUDY,14,ATTIC,10
4,NAME A JOB IN A HOTEL,96,80,120,BELL+(HOP/BOY/MAN/*),39,[DESK+]CLERK,22,MAID/HOUSEKEEPER,15,MANAGER,11
10,WHAT IS THE WEIGHT IN POUNDS OF THE AVERAGE MAN,96,-1,-1,175,32,180,29,160,26,170,23,150,20,165,17,185,14,140,11,155,8,200,5
3,"GIVE ME A WORD FOR ""MISTER"" IN A FOREIGN LANGUAGE",100,46,69,SENOR,22,M(ONSI/IS)EUR,19,H(ER/AI)R,14
5,NAME A COLOR OF JELLY BEANS,97,46,69,RED,22,BLACK,19,GREEN,16,PINK,13,YELLOW,10
10,HOW MANY TV PROGRAMS ARE REALLY WORTH WATCHING,93,-1,-1,5,32,10,29,3,26,6,23,4,20,2,17,20,14,0,11,7,8,15,5
10,NAME A FOOD THAT MIGHT BE EITHER BROWN OR WHITE,97,70,105,BREAD,34,RICE,31,SUGAR,28,EGGS,25,POTATOES,22,CAKE,19,CHOCOLATE,16,GRAVY,13,ICE+CREAM,10,TURKEY,5
12,NAME A SPORT THAT REQUIRES A GOOD ARM,98,106,159,BASEBALL,52,TENNIS,49,ARM+WRESTL(E/ING),46,BOXING,37,FOOTBALL,34,[LIFT+]WEIGHT,31,SHOT+PUT,24,ARCHERY,19,BOWLING,16,POLE+VAULT,13,DISCUS[+THROW],8
6,NAME A COMMON COLOR OF BIRDS,100,54,81,BROWN,26,BLUE,23,BLACK,20,GR(A/E)Y,17,RED,12,YELLOW,9
8,NAME A PLACE WHERE PEOPLE SPEND HOURS DAYDREAMING,89,62,93,PARK,30,SCHOOL,27,HOME,24,BEACH,21,CAR,18,JOB/WORK/OFFICE,15,HAMMOCK,10,LAKE,7
8,NAME A CARD GAME WITH A ONE-WORD NAME,89,62,93,POKER,30,BRIDGE,27,PINOCHLE,24,SOLITAIRE,21,CANASTA,18,EUCHRE/EUKER,15,RUMMY/GIN,11,FISH,7
7,NAME A SPECIFIC OCCASION WHEN RELATIVES VISIT,97,74,111,(CHRIST/X+)MAS,36,BIRTHDAY,29,THANKSGIVING,26,WEDDING/MARRIAGE,23,FUNERAL/DEATH,19,EASTER,15,[FAMILY+]REUNION,12
7,NAME A TYPE OF TABLE,95,76,114,COFFEE/COCKTAIL,37,DINING/KITCHEN,33,POOL,29,CARD/FOLDING/POKER,26,TIME+TABLE,21,END,16,PING+PONG/TABLE+TENNIS,13
4,NAME SOMETHING PEOPLE USE ON THEIR HANDS,99,60,90,LOTION/CREAM,29,SOAP,25,GLOVES,22,[[FINGER]NAIL+]POLISH,19
4,NAME SOMETHING SHOE SOLES ARE MADE OF,98,42,63,LEATHER,20,RUBBER,17,CORK,14,PLASTIC,11
4,NAME A SPORT IN WHICH THE PLAYERS WEAR NO HEADGEAR,88,42,63,BASKETBALL,20,TENNIS,17,SOCCER,14,GOLF,11
4,NAME A PART OF A CAR THAT MAKES NOISE,90,44,66,ENGINE/MOTOR,21,MUFFLER,17,HORN,14,RADIO,11
6,NAME A WEAPON USED IN ANCIENT TIMES,86,84,126,SPEAR/LANCE/JAVELIN,41,SWORD,36,BOW&ARROW/BOW/BOW[+AND]+ARROW,33,CLUB,18,STONEs/ROCK,15,CATAPULT,9
5,"NAME A PLACE PEOPLE DESCRIBE AS AN ""ISLAND PARADISE""",98,68,102,HAWAII,33,TAHITI,30,BAHAMAS/NASSAU,27,BERMUDA,23,VIRGIN+ISL[ANDs],20
4,NAME A SPECIFIC LEFTOVER THAT MAKES GREAT SANDWICHES,94,54,81,[ROAST+]BEEF,26,MEAT+LOAF,19,TURKEY,14,HAM,11
7,NAME A SAINT THAT MANY CHILDREN ARE NAMED AFTER,80,54,81,CHRISTOPHER,26,PETER,23,MARY,20,JOHN,17,JOSEPH,14,PATRICK,11,ANN,8
8,"NAME A MAN'S FIRST NAME THAT BEGINS WITH THE LETTER ""R""",92,58,87,ROBERT,28,RICHARD,25,RONALD,22,RAYMOND,19,RALPH,16,RANDOLPH,13,RODNEY,10,ROGER,7
10,NAME THE FRUIT WITH THE BEST FRAGRANCE,99,66,99,ORANGE,32,STRAWBERRY,29,LEMON,26,PEACH,23,APPLE,20,BANANA,17,WATERMELON,14,PINEAPPLE,11,CANTALOUPE,8,LIME,5
4,NAME A COMIC BOOK SUPER-HERO WHO CAME TO LIFE ON A TV SCREEN,95,46,69,SUPERMAN,22,BATMAN,19,WONDER+WOMAN,16,SPIDERMAN,11
5,NAME AN ANIMAL THAT CAN KILL WITH ITS BITE,91,46,69,SNAKE,22,LION,19,SHARK,16,TIGER,13,WOLF,10
5,NAME SOMETHING SOLDIERS POLISH,97,58,87,BOOTS,28,SHOES,25,GUN,22,BRASS/BUTTONS/[BELT+]BUCKLE,19,MEDALS,10
5,NAME SOMETHING THAT COMES LIME FLAVORED,94,68,102,GELATIN/JELLO,33,ICE+CREAM/SHERBET/POPSICLE,29,[SODA+]POP,22,CANDY,15,KOOL+AID,12
5,NAME A SPORT IN WHICH PEOPLE GET KNOCKED DOWN,98,64,96,FOOTBALL,31,BOXING,28,HOCKEY,25,SOCCER,22,ROLLER+DERBY/ROLLER+SKAT(E/ING),19
5,NAME A FRUIT USED TO FLAVOR PANCAKE SYRUP,88,46,69,BLUEBERRY,22,STRAWBERRY,19,APRICOT,16,BLACKBERRY,13,BOYSENBERRY,10
5,NAME AN OCCASION AFTER WHICH YOU WRITE MANY THANK-YOU NOTES,96,72,108,WEDDING/MARRIAGE,35,(CHRIST/X+)MAS,31,[B(ABY/RIDAL)+]SHOWER,24,BIRTHDAY,13,GRADUATION,10
6,NAME A WAY THAT PEOPLE SHOW JOY,97,50,75,LAUGH,24,SMILE,21,CRY,18,HUG,15,JUMP,12,SING,9
4,NAME A PLACE ON A PERSON'S BODY YOU MIGHT SEE A DIAMOND,100,52,78,FINGER/HAND,25,EAR,21,NAVEL/BELLY+BUTTON,18,NECK/THROAT,12
4,NAME A COMMON COLOR FOR BATHROBES,94,44,66,BLUE/NAVY,21,BROWN,17,PINK,14,WHITE,11
6,NAME A FRUIT USED IN YOGURT,97,54,81,STRAWBERRY,26,PEACH,23,BLUEBERRY,20,PINEAPPLE,17,CHERRY,14,RASpBERRY,11
6,NAME SOMETHING IN THE KITCHEN THAT MAKES A LOT OF NOISE,91,76,114,BLENDER/MIXER,37,[GARBAGE+]DISPOSAL,33,DISHWASHER,26,CAN+OPENER,23,TEA+(POT/KETTLE),18,FAN,9
5,NAME A PLACE IN WHICH YOU MIGHT COMPLAIN TO THE MANAGER,98,92,138,RESTAURANT,45,(H/M)OTEL,42,[GROCERY+]STORE/[SUPER+]MARKET,37,APT BLDG/AP[ARTMEN]T[ *],25,MOVIE/THEATER,11
4,NAME SOMETHING PEOPLE LEASE,99,58,87,APARTMENT/HOUSE,28,CAR/AUTO*,24,STORE,18,OFFICE[+SPACE],15
6,NAME SOMETHING THAT GETS FOLDED AFTER IT'S LAUNDERED,94,58,87,TOWEL,28,SHIRT/BLOUSE,25,SHEET,21,UNDERWEAR,18,PANTS/SLACKS,15,HAN(KY/DKERCHIEF),11
5,NAME SOMETHING PEOPLE BUY FOR A HORSE,98,56,84,SADDLE,27,FEED/HAY/FOOD,24,BLANKET,19,BRIDLE/HALTER,16,SALT BLOCKs,12
6,NAME A GOOD HOBBY FOR SOMEONE WHO LIKES TO BE ALONE,83,54,81,READING,26,STAMPS,23,MODELS,20,PAINTING/DRAW,17,COINS,13,SEWING/KNIT,10
5,NAME SOMETHING A FATHER BUILDS FOR HIS KIDS,83,74,111,(PLAY/TREE)+HOUSE,36,SWING,27,MODELS,24,DOLL+HOUSE,21,TOY+(CHEST/BOX),16
4,NAME A TYPE OF COOKIE THAT PEOPLE BAKE AT HOME,99,66,99,CHOC[OLATE]+CHIP,32,OATMEAL,23,P[EA]NUT+BUTTER,20,SUGAR,11
6,NAME SOMETHING YOU MAKE WITH EGGS,94,70,105,CAKEs,34,OMELET,29,COOKIEs,26,EGGNOG,21,FR[ENCH]+TOAST,18,CUSTARD,9
6,NAME SOMETHING THAT HAS A BUILT-IN FAN,92,92,138,CAR/AUTO*,45,AIR+COND[ITIONER]/AC,39,STOVE/RANGE/OVEN,29,FRIDGE/REFRIGERATOR,24,FURNACE/HEATER,20,HAIR+DRYER/BLOW(ER/+DRYER),16
7,NAME SOMETHING FLAT,82,54,81,TABLE,26,PANCAKE,23,TIRE,20,DESERT,17,FLOOR,14,CHEST,11,BOARD,8
4,NAME SOMETHING A SPORTSMAN SWINGS,100,66,99,BAT,32,[GOLF+]CLUB,29,FISHING+(ROD/POLE),22,RAC(QU/K)ET,13
4,NAME SOMETHING YOU SHOULD JOT DOWN WHEN YOU WITNESS A CRIME,98,58,87,DESCRIPTION,28,(LICENSE/TAG)+NUMBER,25,TIME/HOUR,16,LOCATION/PLACE,12
5,NAME SOMETHING PEOPLE BURN ON PURPOSE,84,48,72,FIREWOOD,23,TRASH/GARBAGE,20,LEAVES,16,CANDLES,13,CIGARETTES,10
6,NAME SOMETHING PEOPLE TAKE IN A CARRY-ON BAG ON AN AIRPLANE,90,72,108,BOOKS/MAGAZINES/READ,35,COSMETICS/TOILETRIES/MAKE+UP,30,MEDICINE/PILLS/DRUGS,23,CAMERA,18,CLOTHES,15,FOOD/SNACKs,12
4,NAME SOMETHING THAT HELPS A STUDENT GET GOOD GRADES,83,52,78,STUDYING,25,CHEATING/COPYING,22,CALCULATOR,18,[GOOD+]MEMORY,15
5,NAME A TYPE OF PERSON WHO SPEAKS AT GRADUATION CEREMONIES,74,58,87,POLITICIAN,28,PRINCIPAL,25,VALEDICT[ORIAN]/STUDENT,22,CLERGYMAN/PRIEST/MINISTER/RABBI,16,PROFESSOR,10
9,NAME A MAN'S HOBBY,91,88,132,FISHING,43,GOLF[ING],40,CARPENTRY/WOODWORK,35,CARS/AUTO*,31,HUNTING,25,COINS,22,MODEL+[AIR]PLANES/MODELS,19,BOWLING,9,GUNS,6
8,NAME A COUNTRY MANY IMMIGRANTS COME FROM,96,66,99,MEXICO,32,ITALY,29,CUBA,26,VIETNAM,23,GERMANY,20,POLAND,17,IRELAND,14,RUSSIA/USSR/SOVIET+UNION,11
7,NAME SOMETHING WHICH SPOTS A CARPET,77,74,111,PETS/DOGS/CATS,36,COFFEE,31,WINE,28,OIL/GREASE,25,SODA[+POP]/COKE/PEPSI/POP,21,INK,11,MUD,8
4,BATMAN HAD ROBIN NAME ANOTHER FAMOUS CRIMEFIGHTER'S SIDEKICK,98,46,69,TONTO,22,WATSON,19,KATO,16,LOIS+LANE,13
5,NAME SOMETHING THAT HAS A SERIAL NUMBER,85,68,102,CAR/AUTO*,33,TV[+SET]/TELEVISION,27,DOLLARS/MONEY/CASH,19,GUN,14,STEREO/RADIO,11
8,NAME SOMETHING YOU MIGHT HEAR WHEN EVERYTHING IS VERY STILL AT NIGHT,83,166,249,CRICKETS,82,DOG[+BARK[ING]]/BARK*,79,(WATER/FAUCET)+*/DRIP*,65,HOUSE[+SETTLE],45,CLOCK[+TICK],38,(CAR/TRAFFIC)+*,31,FROGs,14,OWLs,9
7,"NAME SOMETHING YOU CAN BUY ""CHILD SIZE""",92,82,123,CLOTHING,40,DINNERs/MEAL/FOOD,37,SHOES,30,FURNITURE,27,[TOOTH+]BRUSH,24,ASPIRIN,17,(BI/TRI)(CYCLE/KE),14
5,"NAME SOMETHING BESIDES A CAR THAT MIGHT BE A ""LEMON""",85,76,114,TV[+SET]/TELEVISION,37,HO(USE/ME),29,WASH(ER/ING+MACHINE),24,FRIDGE/REFRIGERATOR,17,STEREO/RECORD+PLAYER,13
4,NAME SOMETHING THAT GETS PLUGGED UP,93,44,66,SINK/DRAIN,21,TOILET,17,NOSE,14,PIPE,11
7,NAME A MEMENTO OF A MEMORABLE DATE THAT PEOPLE SAVE,81,102,153,FLOWERS/CORSAGE,50,TICKET+STUB,46,PICTUREs/PHOTO[GRAPH]s,41,NAPKINs,29,MATCHES,24,CAKE[+TOPs],21,PROGRAMs,10
6,NAME A FOOD PEOPLE EAT IN BARS,95,100,150,PRETZELs,49,PEANUTs,44,POPCORN,39,[POTATO+]CHIPs,36,SANDWICH[ES]/[HAM]BURGERs,23,PIZZAs,11
5,NAME SOMETHING PEOPLE MIGHT USE AS A SUBSTITUTE FOR POKER CHIPS,92,62,93,COINS,30,MATCH(STICK/E)S,27,TOOTH+PICKS,22,BUTTONS,17,[DRY+]BEANS,14
3,NAME SOMETHING KIDS THROW THROUGH THE AIR,97,58,87,BALL,28,FRISBEE,25,[PAPER+][AIR]PLANE,22
4,NAME SOMETHING YOU USE TO FRY FISH,96,54,81,OIL,26,[FRYING+]PAN,23,FLOUR,16,CORN+MEAL,13
4,NAME A FLOWER YOU COULD RECOGNIZE BY ITS SCENT,97,42,63,ROSE,20,CARNATION,17,GARDENIA,14,LILAC,11
4,NAME AN ARTICLE OF CLOTHING MEN BUY IN LOUD PRINTS,94,68,102,SHIRTs,33,TIEs,28,UNDERWEAR/BOXER[+SHORTs],23,PANTS,11
4,NAME A WAY YOU CAN TELL THAT FOOD HAS GONE BAD,100,52,78,SMELL/ODOR,25,MOLD/MILDEW,21,COLOR/SIGHT/LOOK/APPEARANCE,17,TASTE,11
4,NAME SOMETHING THAT COMES OUT OF A MINE,97,42,63,COAL,20,GOLD,17,DIAMONDS,14,SILVER,11
6,NAME SOMETHING PEOPLE WASH WITH A SPONGE,95,100,150,CARS/AUTO*,49,DISHES/POTS/PANS/GLASSES,43,COUNTERs/TABLEs/DRAIN+BOARDs,37,SINKs/BASINs,22,BATHTUB,14,WALLs,11
3,"NAME SOMETHING PEOPLE ""GIVE UP""",82,46,69,SMOKING/CIGARETTE,22,FOOD/DESSERT/EATING,18,CANDY/SWEETS,13
8,NAME A POPULAR FORM OF RECREATION,87,58,87,TENNIS,28,BASEBALL,25,GOLF,22,SWIMMING,19,CAMPING,16,SKIING,13,BOWLING,10,FOOTBALL,7
6,NAME SOMETHING YOU HAVE AT HOME THAT YOU WISH YOU COULD HAVE IN YOUR CAR,94,72,108,TV[+SET]/TELEVISION,35,[TELE]PHONE,27,BATHROOM/TOILET,22,STEREO/TAPE/CD,18,FRIDGE/REFRIGERATOR,13,BED,9
5,NAME SOMETHING THAT SQUIRTS WATER,99,94,141,(WATER/SQUIRT)+(GUN/PISTOL),46,[GARDEN+]HOSE,29,FOUNTAINs,22,[SPRAY+]BOTTLE,17,FAUCET,10
5,NAME A PLACE PEOPLE WOULD LIKE TO VISIT AT LEAST ONCE IN THEIR LIFE,88,52,78,HAWAII,25,EUROPE,22,DISNEYLAND,19,WASHINGTON,16,NEW+YORK/NY,13
4,NAME SOMETHING MADE OF TORTOISE SHELL,90,88,132,JEWELRY/NECKLACEs/EARRINGs,43,ASH+TRAYs,34,[HAIR+](COMB/BRUSH),25,GLASSES/FRAMES,12
5,NAME A SPORT OR ACTIVITY AT WHICH KIDS GET MANY INJURIES,94,62,93,FOOTBALL,30,SKATEBOARD,27,BASEBALL,24,CLIMBING[+TREEs],21,HOCKEY,10
5,NAME A PART OF THE BODY THAT PEOPLE CROSS,99,48,72,LEGS/FEET,23,HEART,19,FINGERS,16,ARMS,13,EYES,10
4,NAME A GOOD PLACE IN THE HOUSE FOR A NIGHT LIGHT,98,76,114,BATHROOM,37,HALLWAY,34,BED+ROOM,31,(CHILD/KID)[']S+ROOM/NURSERY,26
5,NAME SOMETHING THAT LITTERBUGS THROW OUT OF CAR WINDOWS,89,88,132,CIGARETTEs/BUTTs,43,CANs,35,BOTTLEs,30,[PAPER+]CUPs,25,WRAPPERs,12
3,NAME SOMETHING BESIDES COOKIES THAT PEOPLE KEEP IN A COOKIE JAR,95,40,60,MONEY/CASH,19,CANDY,15,BROWNIES,12
6,NAME SOMETHING PEOPLE WEAR THAT IS MADE OF PLASTIC,94,76,114,RAIN+(WEAR/COAT),37,GLASSES,28,OVERSHOEs/SHOE/BOOT/GALOSHES,25,JEWELRY,17,BARRETTES,14,BELTs,11
5,NAME A NEW EXPENSE THAT COMES WITH A NEW BABY,98,62,93,DIAPERS,30,[BABY+]FOOD,27,CLOTHES,20,DOCTOR/HOSPITAL/PHYSICIAN/PEDIATRICIAN,17,CRIB/FURNITURE,11
