6,"NAME A WORD FOR ""GOOD-BYE"" IN A LANGUAGE OTHER THAN ENGLISH",97,56,84,ADIOS,27,ALOHA,24,AU+REVOIR/AREVUAR,21,CIAO,15,SAYONARA,12,ARRIVEDERCI,9
5,NAME A COUNTRY FAMOUS FOR SPICY FOOD,98,46,69,MEXICO,22,ITALY,19,INDIA,16,THAILAND,13,SPAIN,10
5,"NAME AN ACTOR PAST OR PRESENT FAMOUS FOR HIS ""HORROR MOVIES""",94,126,189,[V[INCENT]+]PRICE,62,[B[ELA]+]LUGOSI,51,[B[ORIS]+]KARLOFF,40,[L[ON]+]CHANEY,29,[F[REDDY]+]KREUGER,18
5,NAME A PLACE PEOPLE GO WHEN THEY'RE TROUBLED,93,58,87,CHURCH/CLERGYMAN/MINISTER/PRIEST,28,DOCTOR/PSYCHIATRIST/PHYSICIAN/SHRINK,22,BAR,16,FRIENDS,13,PARENTS,10
5,NAME SOMETHING YOU DO TO A TURKEY,97,86,129,STUFF[+IT],42,COOK[+IT],35,EAT[+IT],28,BASTE[+IT],21,CARVE[+IT],14
4,NAME A FAMOUS CAT,97,42,63,MORRIS,20,GARFIELD,17,FELIX,14,FRITZ,11
6,NAME THE MOST IMPORTANT PERSON IN THE HISTORY OF AMERICA,91,154,231,[G[EORGE]+]WASHINGTON,76,[A[B(E/RAHAM)]+]LINCOLN,65,[C[HRISTOPHER]+]COLUMBUS,50,[T[HOMAS]+]EDISON,39,[B[ENJAMIN]+]FRANKLIN,28,[T[HOMAS]+]JEFFERSON,17
6,NAME SOMETHING YOU PUT IN YOUR EAR,89,92,138,Q+TIP/[COTTON+]SWAB,45,EAR+RING,35,EAR+DROPS,30,EAR+PLUGS,25,HEARING+AID,20,(HEAD/EAR)+PHONES,15
4,"NAME SOMETHING LITTLE GIRLS PUT ON WHEN THEY PLAY ""GROWN-UP""",100,90,135,MAKE+UP,44,[HIGH+]HEELS,39,[MOM[']S+](HAT/CLOTHES),32,WIG,11
5,NAME A PRINCESS,96,46,69,DIANA,22,GRACE,19,ANNE,16,CAROLINE,13,MARGARET,10
8,NAME A FAMOUS BEARDED MAN REAL OR FICTIONAL,89,212,318,[A[B(E/RAHAM)]+]LINCOLN,105,SANTA[+CLAUS],90,BLUEBEARD,83,JESUS[+CHRIST],80,[S[IGMUND]+]FREUD,73,[O[RSON]+]WELLES,62,[U[LYSSES][+S]/GEN[ERAL]]+GRANT,51,[R[AYMOND]+]BURR,15
5,NAME SOMETHING THAT MAKES A MAN LOOK DISTINGUISHED,96,68,102,GR(A/E)Y+HAIR,33,[HIS+]CLOTHES,24,MOUSTACHE/MUSTACHE,17,BEARD,13,PIPE,10
6,"NAME A MALE STAR WHO HAS THE WORST ""TEMPERAMENT"" OFF SCREEN",77,174,261,[S[EAN]+]PENN,86,[B[RUCE]+]WILLIS,75,[F[RANK]+]SINATRA,64,[S[(YLVESTER/LY)]+]STALLONE,53,[B[URT]+]REYNOLDS,38,[R[YAN]+]O[']NEAL,27
5,NAME AN OCCUPATION WHOSE MEMBERS PLAY GOLF DURING BUSINESS HOURS,98,54,81,PHYSICIANS/DOCTORS/MEDICINE,26,LAWYERS/ATTORNEY,21,BANKERS,17,CONGRESSMEN/POLITICIANS,14,SALESMEN,10
4,NAME A EUROPEAN COUNTRY AMERICANS VISIT,96,42,63,FRANCE,20,ENGLAND,17,ITALY,14,GERMANY,11
4,HOW DO NEW PARENTS PICK A NAME FOR THEIR BABY,95,58,87,RELATIVE[']S,28,BOOK,23,AFTER+(SELF/THEMSELVES),20,FAMOUS,11
6,NAME AN ARTICLE SOMEONE MIGHT WEAR EVEN AT A NUDIST COLONY,90,54,81,[EYE]GLASSES,26,RING,21,WATCH,18,SHOES,15,HAT,12,EARRINGS,9
6,NAME SOMETHING SWITZERLAND IS FAMOUS FOR,95,52,78,ALPS,25,SKIING,22,CHOCOLATE,19,WATCHES/CLOCKS,16,CHEESE,12,BANKS,9
7,NAME SOMETHING YOU ARE SURE TO TURN OFF BEFORE YOU LEAVE THE HOUSE FOR THE DAY,97,78,117,STOVE/OVEN,38,COFFEE+POT,34,IRON,29,HEATER,26,CURLING+IRON/CURLER/ROLLERS,23,LIGHTS,16,TV[+SET]/TELEVISION,13
4,WHY DO PEOPLE EAT IN FAST-FOOD RESTAURANTS,95,78,117,[[TO+]SAVE+]TIME/CONVENIENCE,38,CHEAP/INEXPENSIVE,22,[NO+]COOKING,18,TASTE,11
3,NAME SOMETHING YOU BUY BY THE ROLL,80,60,90,TOILET+PAP[ER]/TOILET+TISSUE,29,PAPER+TOWEL,17,FILM,12
6,NAME AN OCCUPATION THAT REQUIRES A STEADY HAND,92,70,105,SURGEON/PHYSICIAN,34,DIAMOND+CUT[TER],30,ARTIST,21,DENTIST,18,HOUSE+PAINT/PAINTER,15,WELDER,9
7,NAME SOMETHING BESIDES FOOD THAT YOU MIGHT FIND IN A PICNIC BASKET,95,56,84,NAPKINS,27,PLATES,24,SILVERWARE/UTENSILS,21,TABLECLOTH,17,ANTS,14,WINE,11,BLANKET,8
4,NAME SOMETHING YOU DO WHILE SOAKING IN THE TUB,88,44,66,READ,21,RELAX/SLEEP,18,SING,14,SHAVE,11
7,NAME SOMETHING THAT HAPPENS AT EVERY WEDDING,91,166,249,KISS+[THE+]BRIDE,82,CRYING,69,(TOSS/THROW)+(BOUQUET/FLOWERS),66,THROW+RICE,49,CUT+[THE+]CAKE,44,(SAY/EXCHANGE)+VOWS,31,(GIVE/EXCHANGE)+RINGs,22
5,NAME SOMETHING A WOMAN TRIES TO GUESS ABOUT A MAN BEFORE A BLIND DATE,96,124,186,[HIS+]LOOKS,61,[HIS+]HEIGHT,54,[HIS+]AGE,47,[HIS+]PERSONALITY,40,KIND+OF+CAR/[* ][OF+]CAR,33
4,NAME A PLACE WHERE YOU'D HATE TO BE SEATED NEAR A SCREAMING BABY,96,48,72,THEATER/MOVIES,23,CHURCH,19,RESTAURANT,16,[AIR]PLANE,13
6,BESIDES THE BERING SEA NAME ANOTHER SEA,91,54,81,RED,26,MEDIT('/ERRANEA)N,23,DEAD,18,BALTIC,15,CARIBBEAN,12,BLACK,9
5,NAME SOMETHING YOU PUT ON A PIZZA,93,46,69,CHEESE,22,PEPPERONI,19,MUSHROOMS,16,SAUSAGE,13,TOMATO,10
4,NAME A FAMOUS CIGAR SMOKER,96,98,147,[G[EORGE]+]BURNS,48,GROUCHO[+MARX],37,[W[INSTON]+]CHURCHILL,30,[W+C+]FIELDS,19
3,NAME SOMETHING PEOPLE DONATE TO THE SALVATION ARMY,98,38,57,CLOTHES,18,FURNITURE,15,MONEY,12
8,NAME SOMETHING THAT CREAKS,93,68,102,DOOR,33,FLOOR,30,STAIRS/STEPS,27,BED,23,SHOES,20,ROCK(ER/ING+CHAIR),17,BONES,10,HOUSE,7
8,NAME A POSITION ON A BASEBALL TEAM,95,80,120,PITCHER,39,SHORTSTOP,36,CATCHER,33,FIRST BASE,30,(LEFT+/RIGHT+/OUT)FIELD,27,CENTERFIELD,17,THIRD+BASE,14,SECOND+BASE,9
11,HOW MANY HOURS PER DAY DO BABIES SLEEP,98,-1,-1,12,34,18,31,16,28,15,25,20,22,14,19,6,16,4,13,8,10,10,7,3,4
4,NAME SOMEONE CONNECTED WITH THE CIVIL WAR,96,206,309,[U[LYSSES][+S]/GEN[ERAL]]+GRANT,102,[A[B(E/RAHAM)]+]LINCOLN,66,[R[[OBERT]+E]+]LEE,51,[W[ILLIAM]/GEN[ERAL]]+SHERMAN,28
5,NAME THE BEST TEENAGE YEAR,99,-1,-1,16,22,18,19,17,16,19,13,15,10
6,NAME A CREAMED VEGETABLE,95,66,99,CORN,32,PEAs,29,CARROTs,24,SPINACH,19,POTATO[ES],16,ONIONs,11
9,"HOW OLD WERE YOU THE FIRST TIME YOU SUFFERED A ""BROKEN HEART""",96,-1,-1,16,30,14,27,13,24,15,21,12,18,18,15,17,12,10,9,9,6
6,NAME THE SPORT WHOSE REFEREES MAKE THE MOST MISTAKES,99,50,75,FOOTBALL,24,BASKETBALL,21,BASEBALL,18,HOCKEY,15,BOXING,12,WRESTLING,9
6,NAME AN INSECT THAT DISAPPEARS IN WINTER,97,50,75,FLY,24,MOSQUITO,21,ANT,18,BEE,15,MOTH,12,SPIDER,9
6,NAME THE IDEAL INDOOR TEMPERATURE IN DEGREES,96,-1,-1,70,24,72,21,68,18,65,15,75,12,78,9
5,"NAME SOMETHING THAT ""TIES YOU DOWN""",89,62,93,CHILDREN/KIDS/BABIES,30,JOB/WORK,25,MARRIAGE/SPOUSE/MATE,21,PETS,16,SWEETHEART/(BOY/GIRL)FRIEND,13
5,NAME SOMEONE CONNECTED WITH THE AMERICAN REVOLUTION,95,126,189,[G[EORGE]+]WASHINGTON,62,[P[AUL]+]REVERE,51,[P[AUL]+]HENRY,40,[B[ENNEDICT]+]ARNOLD,29,[T[HOMAS]+]JEFFERSON,18
4,BESIDES CAPE HATTERAS NAME A WELL-KNOWN CAPE,98,130,195,[CAPE+]COD,64,[CAPE+](CANAVERAL/KENNEDY),57,[CAPE+]HORN,44,[CAPE+[OF+]]GOOD+HOPE,37
3,NAME SOMETHING THAT MOVES VERY SLOWLY,90,40,60,TURTLE/TORTOISE,19,SNAIL,15,WORM,12
7,NAME SOMETHING YOU EAT BY THE SLICE,93,64,96,BREAD,31,PIZZA,28,CAKE,25,PIE,22,CHEESE,19,ORANGE,16,COLD+CUTS/LUNCH+MEAT,13
10,NAME SOME FAMOUS BROTHERS REAL OR FICTIONAL,91,70,105,SMOTHERS,34,MARX,31,WRI[GH]T,28,SMITH,23,GRIMM,20,BLUES,17,JAMES,14,KENNEDY,11,RINGLING,8,STATLER,5
4,NAME SOMETHING THAT VAMPIRES HATE,96,58,87,DAYLIGHT,28,CROSS[ES],25,GARLIC,20,WOOD+STAKEs,17
5,NAME SOMETHING THAT OFTEN GETS A HOLE IN IT,91,88,132,SO(CKs/X),43,PANTYHOSE/NYLONs/STOCKINGs,36,PANTS/POCKETs,27,DO[UGH]NUTs,21,SHIRTs,12
7,NAME A FAMOUS AMERICAN INDIAN REAL OR FICTIONAL,94,74,111,SIT('G/TING)+BULL,36,GERONIMO,27,COCHISE,24,POCAHONTAS,21,JIM+THORPE,18,TONTO,13,CRAZY+HORSE,10
4,WHAT EUROPEAN CITY WOULD YOU MOST LIKE TO VISIT,86,42,63,PARIS,20,LONDON,17,ROME,14,VENICE,11
7,NAME A FOOD RECOGNIZABLE BY ITS ODOR,87,54,81,ONIONS,26,FISH,23,GARLIC,20,PIZZA,17,CABBAGE,14,POPCORN,11,CHEESE,8
4,NAME A DOCUMENT THAT IDENTIFIES YOU IN SOME WAY,96,110,165,DR[IVERs]+LICENSE,54,BIRTH+CERTIFICATE,41,PASSPORT,36,SOCIAL+SEC[URITY][+CARD],33
3,NAME SOMETHING YOU BEAT,95,40,60,DRUM,19,EGGS,16,RUGS/CARPET,13
7,NAME THE BODY PART THAT WOMEN SPEND THE MOST TIME FRETTING OVER,100,70,105,FACE/MOUTH/EYES,34,HAIR,29,BUST/BREASTS,26,HIPS,22,STOMACH/WAIST/TUMMY/BELLY,19,REAR/BEHIND/BUTT,13,THIGH,8
4,NAME A FAMOUS JACKSON,94,42,63,MICHAEL,20,ANDREW,17,JESSE,14,JANET,11
5,NAME SOMETHING PEOPLE USE TO KEEP BURGLARS AWAY,100,52,78,DOG/* DOG,25,ALARM,19,LIGHTS,16,LOCKS,13,GUNS,10
4,NAME SOMETHING PEOPLE BET MONEY ON,100,86,129,HORSE[S/+RACEs]/RACES,42,DOG[S/+RACEs],29,BALL+GAMES/FOOTBALL,17,CARDS,11
8,NAME A REAL OR FICTIONAL MAN KNOWN AS A FAMOUS LOVER,82,134,201,VALENTINO,66,CASANOVA,63,DON+JUAN,60,[C[LARK]+]GABLE,55,[E[RROL]+]FLYNN,44,ROMEO,33,[B[URT]+]REYNOLDS,30,[R[OB[ERT]]+]REDFORD,19
5,NAME SOMETHING PEOPLE DO WITH THEIR HANDS WHEN THEY'RE COLD,98,118,177,(RUB/WRING)+THEM,58,[PUT+IN+]POCKETS,49,BLOW+ON[+THEM],38,WEAR+(GLOVE/MITTEN)S,25,SIT+ON+THEM,16
7,NAME SOMETHING GOOD TO EAT THAT COMES IN A SHELL,95,54,81,NUTS,26,CLAMS,23,LOBSTER,20,OYSTERS,17,CRAB,14,SHRIMP,11,TACO,8
4,NAME AN OCCUPATION IN WHICH A MAN USES HIS GOOD LOOKS,96,42,63,MODELING,20,ACTING,17,SALESMAN,14,GIGOLO,11
5,NAME A GAME PEOPLE PLAY IN THEIR BACKYARD,87,56,84,CROQUET,27,BADMINTON,24,VOLLEYBALL,21,HORSESHOES,18,PING+PONG/TABLE+TENNIS,15
7,NAME SOMETHING PEOPLE STICK PINS IN,97,86,129,PIN+CUSHION,42,MATERIAL/CLOTHES/FABRIC,37,BULL[ETIN]+BOARD,32,MAP,23,CORK,20,DIAPER,17,VOODOO+DOLLs,14
5,WHY DOES A WOMAN WHO HAS RESISTED MARRIAGE FINALLY AGREE,94,114,171,[[TO+]HAVE+](KIDS/CHILDREN),56,AG(E/ING)/[GETTING+]OLDER,27,LONELINESS/ALONE,17,LOVE,13,MONEY,10
6,WHO IS THE MOST ADMIRED ATHLETE OF ALL TIME,81,98,147,[BABE+]RUTH,48,[JIM+]THORPE,41,[JESSE+]OWENS,34,[BRUCE+]JENNER,27,[ROGER+]STAUBACH,20,[JOE+]LOUIS,13
3,NAME A BAD HABIT PEOPLE WOULD LIKE TO BREAK,99,66,99,SMOKING,32,[FINGER]NAIL+BITING/BITING+[FINGER]NAILS,29,SWEARING/CURSING,13
7,NAME SOMETHING YOU LICK,100,62,93,ICE+CREAM/POPSICLE/CONE,30,CANDY,23,STAMPS,20,ENVELOPE,17,LIPS,14,FINGERS,11,SPOON,8
5,WHAT COUNTRY IS THE WORLD'S WORST TROUBLE-MAKER,97,54,81,IRAN,26,RUSSIA/USSR/SOVIET+UNION,23,LIBYA,16,ISRAEL,13,LEBANON,10
5,NAME SOMETHING THAT THE FAMILY TAKES TURNS USING,93,84,126,BATHROOM,41,CAR/AUTO*,38,[HAIR/BLOW]+DRYER,32,[TELE]PHONE,20,TV[+SET]/TELEVISION,15
4,NAME AN EXCUSE PEOPLE GIVE FOR BEING LATE,92,58,87,TRAFFIC,28,OVER+SLEPT,25,CAR+TROUBLE,20,[PHONE+]CALL,15
5,WHAT DO YOU THINK IS AMERICA'S MOST POPULAR FOOD,95,90,135,[HAM]BURGERs,44,PIZZAs,35,HOT+DOGs/FRANK[FURTER]s,30,CHICKEN,14,PASTA/SPAGHETTI,11
4,NAME AN OCCASION WHEN PEOPLE PUT UP SPECIAL DECORATIONS,96,50,75,(CHRIST/X+)MAS,24,BIRTHDAY,17,EASTER,14,HALLOWEEN,11
3,NAME THE GIFT WOMEN LOVE THE MOST FROM MEN,99,38,57,JEWELRY,18,FLOWERS,15,MONEY,12
5,NAME SOMETHING THAT PEOPLE CHEAT ON,100,76,114,[INCOME+]TAX[ES],37,TEST/EXAM,24,DIET,20,SPOUSE/SWEETHEART/MATE/WIFE/HUSBAND,17,CARDS,10
6,NAME THE WORST PRESIDENT IN US HISTORY,86,154,231,[RICHARD+]NIXON,76,[JIMMY+]CARTER,69,[(U[LYSSES][+S]/GEN[ERAL])+]GRANT,62,[RONALD+]REAGAN,27,[WARREN+]HARDING,20,[HERBERT+]HOOVER,13
7,NAME SOMETHING THAT MEN DO BEFORE GOING ON A DATE,94,126,189,SHAVE,62,BATHE/SHOWER,59,[PUT+ON+](COLOGNE/AFTERSHAVE),55,BRUSH+TEETH,34,COMB+HAIR,29,(COUNT/GET/CHECK)+MONEY,24,[BREATH+]MINT,12
4,NAME SOMETHING THAT PEOPLE SAVE,89,48,72,MONEY,23,PHOTO[GRAPH]S/PICTURES,20,COUPONS,14,STAMPS,11
3,NAME AN IMPORTANT ONCE-A-YEAR SPORTS EVENT,94,50,75,SUPER+BOWL,24,WORLD+SERIES,19,ROSE+BOWL,14
5,NAME A JOB IN WHICH PEOPLE MAKE MORE MONEY THAN THEY DESERVE,82,50,75,LAWYER/ATTORNEY,24,ATHLETE,20,ACTOR,17,PHYSICIAN/DOCTOR,14,POLITICIAN,10
6,NAME A FAMOUS RUSSIAN,91,62,93,GORBACHEV,30,STALIN,27,BARYSHNIKOV,24,LENIN,21,KhRUShCHEV,18,TOLSTOY,9
6,NAME SOMETHING YOU CAN DO TO STAY AWAKE WHILE DRIVING,96,116,174,SING,57,[OPEN/ROLL+DOWN]+WINDOW,54,[PLAY/TURN+ON]+RADIO,38,[DRINK+]COFFEE,22,EAT/CHEW+GUM,15,TALK,9
6,IF YOU'RE SHORT OF MONEY WHAT'S THE ONE BILL YOU'RE SURE TO PAY,97,104,156,RENT/MORtGAGE,51,ELECTRIC/UTILITY,45,[TELE]PHONE,41,GAS/HEAT,36,(CAR/AUTO)+INSURANCE,32,(CAR/AUTO)+(PAYMENT/LOAN),23
3,NAME A TYPE OF CAMPBELL'S SOUP,96,38,57,CHICKEN,18,TOMATO,15,VEGETABLE,12
11,NAME THE COUNTRY YOU'D BE MOST INTERESTED IN LEARNING ABOUT,88,100,150,ENGLAND/GREAT+BRITAIN/UNITED+KINGDOM/UK,49,FRANCE,39,CHINA,36,GERMANY,33,USA/AMERICA/UNITED+STATES,30,RUSSIA/USSR/SOVIET+UNION,23,AUSTRALIA,16,CANADA,13,JAPAN,10,MEXICO,7,IRELAND,4
2,NAME A DRINK MADE WITH ICE CREAM,100,38,57,FLOAT/SODA,18,MILKSHAKE/MALT,14
3,NAME A ROOM YOU PUT A TV IN,99,50,75,DEN/FAMILY/STUDY,24,LIVING+ROOM,19,BED+ROOM,14
9,NAME SOMETHING A HUSBAND ASKS HIS WIFE TO CARRY IN HER PURSE,92,86,129,KEYS,42,CIGARETTES,39,GLASSES/[EYE/SUN]+GLASSES,36,WALLET,23,CHECKBOOK,20,COMB,17,PILLS/MEDICINE,14,TISSUES/KLEENEX,10,MONEY,6
9,NAME SOMETHING USED TO KEEP OUT THE SUN,97,92,138,[SUN]GLASSES,45,UMBRELLA,40,W(ND/INDO)W+SHADE,37,VISOR,28,HAT,25,SUN(TAN+LOTION/SCREEN)/BLOCK,22,BLINDS/VENETIANS/VERTICALS,14,DRAPES,9,TREE,6
3,NAME SOMETHING YOU SERVE WITH CAKE,98,42,63,ICE+CREAM,20,COFFEE,15,MILK,12
6,NAME THE DAY OF THE WEEK WHEN YOUR GARBAGE GETS COLLECTED,100,74,111,MON[DAY],36,WED[NESDAY],31,TUE[SDAY],26,FRI[DAY],21,THU[RSDAY],16,SAT[URDAY],11
2,NAME A BAD HABIT THAT MIGHT ALSO BE A NERVOUS HABIT,95,62,93,[FINGER]NAIL+BITING/BITING+[FINGER]NAILS,30,SMOKING/CIGARETTES,14
12,HOW MANY LAMPS DO YOU HAVE IN YOUR HOME,95,-1,-1,6,34,5,31,10,28,4,25,8,22,3,19,7,16,9,13,2,10,12,7,15,4
4,NAME SOMETHING THAT MAKES GETTING DIVORCED HARDER THAN GETTING MARRIED,94,76,114,SETTLEMENTS/ALIMONY/SUPPORT/PAYMENTS,37,CHILDREN/KIDS/[CHILD+]CUSTODY,31,LEGAL+FEES/LAWYER/ATTORNEY/COST,22,LIVING+ALONE/LONELY,14
7,NAME SOMETHING THAT SOME PEOPLE LIKE TO DO ALONE AND SOME PEOPLE DON'T,68,72,108,GO+OUT,35,EAT/DINE,30,WATCH+T(V/ELEVISION),26,DRINK,17,SLEEP,14,STUDY,11,WORK,8
5,NAME A WAY A MOTHER CAN TELL JUST BY LOOKING THAT HER CHILD IS SICK,97,66,99,COLORING/PALE/RED/FLUSHED,32,EYES,26,LOOKS+TIRED,23,RUNNY+NOSE,18,NOT+EATING/APPETITE,13
5,NAME SOMETHING YOU DO WHEN YOU CALL INTO WORK SICK BUT YOU'RE FINE,72,70,105,GO+SHOPPING,34,PLAY+GOLF,29,CLEAN+HOUSE,24,SLEEP,19,GO+TO+BEACH,16
5,NAME SOMETHING HOTELS OFFER TO ENTICE CUSTOMERS,76,86,129,POOL,42,FREE+T(V/ELEVISION),39,WATER+BEDs,30,LOW+RATEs,21,BREAKFAST/MEALS/FOOD,12
3,NAME AN EXPENSE THAT'S GREATER WITH DAUGHTERS THAN WITH SONS,95,42,63,WEDDINGS/MARRIAGE,20,CLOTHES,16,COSMETICS/MAKE-UP,13
4,NAME A QUESTION YOU MIGHT ANSWER WITH A LIE OTHER THAN YOUR AGE,84,68,102,[YOUR+]WEIGHT,33,INCOME/MONEY/SALARY,26,HAIR+COLOR/NATURAL,21,MAR(RIED/ITAL+STATUS),15
8,NAME SOMETHING EVERY DOCTOR HAS,91,70,105,STETHOSCOPE,34,NURSE,31,PATIENTS,28,LICENSE,25,DEGREE,22,THERMOMETER,19,BED[SIDE]+MANNER,16,INSURANCE,7
5,NAME SOMEONE WHO HAS TO LISTEN TO PROBLEMS ALL DAY LONG,87,60,90,CLERGYMAN/PRIEST/MINISTER/RABBI,29,COUNSELOR/SOCIAL WORKER,23,BAR(TENDER/MAID),19,LAWYER/ATTORNEY,14,JUDGE,10
5,NAME A FAMOUS FAIRY,97,66,99,TINKERBELL,32,TOOTH+FAIRY,29,[FAIRY+]GODMOTHER,24,PETER+PAN,17,GOOD+FAIRY,12
6,NAME SOMETHING KIDS DO OTHER THAN STUDY WHEN THEY'RE IN SCHOOL,91,80,120,DAYDREAM,39,SLEEP,36,MISBEHAVE/UNRULY/*+TROUBLE,33,DRAW/DOODLE,22,TALK,18,PLAY+HOOKY/DITCH/CUT+CLASS,15
6,NAME SOMETHING YOU DO TO CHEER SOMEONE UP,90,122,183,TELL+JOKES,60,[SEND+](FLOWERs/GIFT),55,TALK/TELEPHONE/CALL,36,[SEND+][A+]CARD,31,VISIT,12,TAKE OUT,9
6,NAME SOMETHING YOU HATED TO DO WHEN YOU WERE A CHILD BUT WISH YOU COULD DO NOW,84,94,141,NAP/SLEEP,46,[GO+TO+]SCHOOL,42,MUSIC+LESSONs/* LESSONs,31,EAT,15,SAVE MONEY,12,TRAVEL,9
7,NAME SOMETHING BOYS GENERALLY START DOING AT A YOUNGER AGE THAN GIRLS,70,124,186,SMOKING,61,DRIV(E/ING)[+CAR],58,DATING,45,STAY[ING]+OUT[+LATE],42,WORK[ING],17,DRINKING,12,SPORTS/ATHLETICS,9
3,NAME SOMETHING THAT IS MORE DIFFICULT FOR A WOMAN TO DO THAN FOR A MAN,79,72,108,LIFT/CARRY,35,(FIX/REPAIR)+CAR,31,GET+[A+]JOB,22
5,WHAT IS THE MOST IMPORTANT QUALITY A SCHOOL TEACHER SHOULD HAVE,83,46,69,PATIENCE,22,PERSONALITY,19,LOVE,16,DEDICATION,13,FAIRNESS,10
3,NAME ONE OF THE HEMINGWAYS,97,40,60,ERNEST/PAPA,19,MARGAUX,15,MARIEL,12
3,IF YOU WORKED A FOUR-DAY WEEK WHICH WEEKDAY WOULD YOU LIKE OFF,99,50,75,FRI[DAY],24,MON[DAY],19,WED[NESDAY],14
4,NAME SOMETHING A DOOR-TO-DOOR SALESPERSON SELLS,82,54,81,BRUSHES,26,VACUUMS/VACUUM+CLEANERS,23,MAGAZINES,17,COSMETICS/MAKE+UP,14
4,NAME SOMETHING THAT COMES IN BUNCHES,82,42,63,FLOWERS,20,BANANAS,17,CARROTS,14,GRAPES,11
5,NAME SOMETHING THAT MOST YOUNG PEOPLE HOPE THE FUTURE HOLDS FOR THEM,94,64,96,MONEY/SUCCESS/WEALTH/FORTUNE,31,HAPPINESS,25,GOOD+HEALTH/LONG+LIFE,22,MARRIAGE/FAMILY,14,FAME,10
3,NAME SOMETHING THAT TENANTS CALL THE LANDLORD TO FIX,99,54,81,PLUMBING/FAUCETS/PIPES/SINK/TOILET,26,HEATER/FURNACE/BURNER,19,LEAKY+ROOF,14
3,NAME SOMETHING THAT KIDS PLAY WITH IN THE BATHTUB,97,54,81,[RUBBER+]DUCK,26,[TOY+]BOAT,19,SOAP,12
3,NAME SOMETHING THAT MAKES A PERSON A BAD TENANT,87,64,96,NOISY/LOUD,31,LATE[+WITH]+RENT,27,SLOPPY/MESSY/DIRTY,14
6,NAME SOMETHING MANY AMERICANS ARE APATHETIC ABOUT,77,84,126,POLITICS/VOTING,41,HUNGER/STARVING+PEOPLE/STARVATION,37,WORLD+(NEWS/EVENTS)/INTERNATIONAL/EVENTS,30,INFLATION/TAXES,19,ENERGY,15,LITTER[ING]/POLLUTION,12
6,"PEOPLE SAY ""YOU CAN'T FIGHT CITY HALL"" BUT HOW COULD YOU TRY",89,96,144,PETITIONS,47,PICKET/PROTEST/MARCH,44,WRITE/LETTERS,39,GET+A+LAWYER/ATTORNEY,35,PAY+NO+TAX,25,POLITICS/RUN+FOR+OFFICE,16
8,NAME SOMETHING THAT'S EASY FOR CHILDREN TO LEARN BUT HARD FOR ADULTS,84,86,129,SKATE,42,LANGUAGE/FOREIGN[ LANGUAGE],39,RIDE+(BI(KE/CYCLE)),33,SWIM,22,READ,19,PLAY PIANO/PLAY *,16,SKI,10,DANCE,7
5,NAME SOMETHING THAT DRIVES MEN TO AN EARLIER GRAVE THAN WOMEN,91,60,90,WORK/JOB/CAREER/PROFESSION,29,WOMEN/MARRIAGE,23,STRESS/WORRY,19,DRINKING/ALCOHOL,15,SMOKING/CIGARETTE,11
3,NAME A FRUIT THAT'S GOOD ON BREAKFAST CEREAL,99,38,57,BANANAS,18,STRAWBERRY,15,PEACHES,12
5,NAME A REASON PEOPLE QUIT SCHOOL,94,70,105,WORK/JOB,34,NO+INTEREST/BORED,30,TOO+HARD/FAILING/GRADES/DIFFICULT,24,PREGNANCY,16,GET+MARRIED/MARRIAGE,13
5,NAME A JOB OLD BALL PLAYERS GET WHEN THEIR PLAYING DAYS ARE OVER,97,82,123,(BROAD/SPORTS)CASTER/RADIO/TV/TELEVISION,40,COACHING/MANAGER,32,ACTOR/COMMERCIALS/ADVERTISING,28,SALES,23,OWN+[A+]RESTAURANT,20
6,NAME SOMETHING MANY PARENTS POSTPONE DOING UNTIL THE KIDS ARE GROWN,97,60,90,TRAVELLING/TRIP/VACATION/HOLIDAY,29,DIVORCE,23,MOVING,20,DECORATING,17,NEW+CAR,14,SAVING,9
3,NAME A DAY OF THE YEAR WHEN IT'S HARD TO CALL LONG DISTANCE,99,70,105,(CHRIST/X+)MAS,34,MOTHER[']S+DAY,27,NEW+YEAR[']S,18
3,NAME SOMETHING YOU GIVE THANKS FOR WHEN SAYING GRACE,97,38,57,FOOD,18,HEALTH,15,FAMILY,12
4,NAME SOMETHING THAT BOTHERS YOU WHEN YOU'RE SLEEPING IN AN UNFAMILIAR ROOM,87,46,69,BED/MATTRESS,22,NOISES/SOUND,18,PILLOWS,14,CLOCK,11
8,NAME SOMETHING A WIFE DOES THAT MAKES HER HUSBAND NERVOUS,85,90,135,DRIVES[[+THE]+CAR],44,SPENDS+MONEY/SHOPS,29,NAGS/COMPLAINS,23,TALKS,19,LATE,16,CRIES,13,FLIRTS,10,PREGNANT,7
4,NAME SOMETHING TEENAGERS CAN DO FOR HOURS,90,120,180,TALK[[+ON]+PHONE],59,LISTENMUSIC/[* ](MUSIC/RADIO/RECORD/TAPE/CD),44,DANCE/PARTY,21,WATCH+(TV/TELEVISION),17
6,NAME SOMETHING BESIDES A BATHING SUIT THAT PEOPLE WEAR TO SWIM,97,82,123,BATHING+CAP,40,SHORTS,35,NOTHING,32,DIVING+GEAR/WETSUIT/SCUBA,29,LIFE+[JACKET/VEST],22,NOSE+PLUG,11
3,NAME A WORK YOU MIGHT NOT BECOME FAMOUS IN UNTIL AFTER YOU'RE DEAD,92,44,66,ARTIST/PAINTER,21,WRITER/AUTHOR,17,SCIENTIST/INVENTOR,13
6,NAME AN EXPENSE THAT'S MORE FOR PARENTS WITH SONS THAN DAUGHTERS,95,64,96,[BUY/PURCHASE+]CAR,31,EDUCATION/SCHOOL/COLLEGE,23,INSURANCE,18,SPORTS,15,FOOD,12,DATING,9
6,NAME SOMETHING PEOPLE DO WHEN THEY'VE LOST THEIR DOG,99,96,144,ADVERTISE,47,CALL+(POUND/SHELTER),44,CRY,35,LOOK+FOR/SEARCH,32,[OFFER+]REWARD,26,CALL+[THE+]POLICE,19
7,NAME SOMETHING PEOPLE WOULD LIKE TO RIDE IN,88,86,129,SPACE+(SHIP/SHUTTLE),42,LIMOUSINE/LUXURY+CAR,33,BLIMP/DIRIGIBLE,27,HELICOPTER,23,BALLOON,20,CRUISE+SHIP,17,RACE(+CAR/R),12
5,NAME SOMETHING WOMEN SPEND MORE ON THAN MEN,93,68,102,COSMETICS/MAKE+UP,33,UNDERWEAR/LINGERIE,27,HAIRDRESSER/BEAUTY+(SALON/PARLOR),23,CLOTHES,13,JEWELRY,10
6,NAME AN ACTIVITY THAT USED TO BE HELD ON COLLEGE CAMPUSES,80,80,120,PANTY+RAIDS,39,SIT+INS/DEMONSTRATIONS,34,HAZING/INITIATIONS,28,SWALLOW[ING]+FISH/GOLDFISH,24,PEP+RALLIES,14,STREAKING,9
4,NAME SOMETHING PEOPLE SHOULD FORCE THEMSELVES TO DO MORE OFTEN,78,86,129,EXERCISE,42,[GO+][TO+]CHURCH,39,DIET,20,SEE+(DOCTOR/PHYSICIAN),17
4,NAME A STATE WHERE COTTON IS GROWN,86,50,75,ALABAMA/AL,24,GEORGIA/GA,20,MISSISSIPPI/MS,16,LOUISIANA/LA,12
3,NAME A MEAT USED IN SANDWICHES,77,44,66,HAM,21,BOLOGNA/BALONEY,18,ROAST+BEEF,14
4,NAME YOUR MOST COMFORTABLE ROOM,100,52,78,BEDROOM,25,LIVING+ROOM,22,DEN/FAMILY+ROOM,17,KITCHEN,11
4,NAME SOMETHING THAT TASTES SWEET,85,42,63,CANDY,20,SUGAR,17,CHOCOLATE,14,HONEY,11
4,NAME SOMETHING KIDS PUT OFF DOING,98,66,99,HOMEWORK,32,CHORES/JOBS,29,WASHING/BATH,25,GOING[+TO]+BED,21
4,NAME SOMETHING FIREMEN DO,78,80,120,CLIMB+LAD[DERS],39,FIGHT+FIRES/PUT+OUT+FIRES,30,FIRST+AID,18,SAVE+PEOPLE,13
4,NAME AN ARTICLE OF SKI CLOTHING,70,44,66,JACKET/PARKA,21,BOOTS,17,SWEATER,14,GLOVES,11
3,NAME SOMETHING YOU PUT IN TEA,92,38,57,SUGAR,18,LEMON,15,MILK,12
4,NAME A PLACE YOU HEAR VERY LOUD MUSIC,90,52,78,DISCO[THEQUE],25,CONCERT,20,BAR,17,NIGHT+CLUB/CLUB,14
4,NAME SOMETHING YOU POLISH,82,42,63,CAR,20,SHOES,17,FURNITURE,14,SILVER,11
4,NAME A FOOD SERVED AT COOKOUTS,87,68,102,[HAM]BURGERS,33,HOT+DOGS/FRANK[FURTER]S,28,POT[ATO]+SALAD,20,BEANS,11
4,NAME SOMETHING A PORTRAIT PAINTER USES,93,42,63,BRUSH,20,EASEL,17,PAINT,14,CANVAS,11
4,NAME SOMETHING YOU DRINK IN THE MORNING,94,42,63,COFFEE,20,JUICE,17,MILK,14,TEA,11
3,NAME A SPORT THAT'S FUN TO PLAY BUT BORING TO WATCH,68,38,57,GOLF,18,TENNIS,15,BASEBALL,12
7,NAME SOMETHING LITTLE BOYS COLLECT,84,66,99,MARBLES,32,B[ASE]BALL+CARDS,29,BUGS,20,ROCKS,17,FROGS,14,CARS,11,STAMPS,8
4,NAME THE MONTH WHEN YOU MAIL IN YOUR INCOME TAX RETURN,100,58,87,FEB[RUARY],28,APR[IL],23,MAR[CH],18,JAN[UARY],13
6,NAME THE MONTH WHEN YOU START SHOPPING FOR SUMMER CLOTHES,99,70,105,APR[IL],34,MAR[CH],29,MAY,24,FEB[RUARY],21,JUNe,16,JAN[UARY],11
10,NAME AN EXPENSIVE BREED OF DOG,80,120,180,POODLE/* POODLE,59,AFGHAN,53,GREAT+DANE,50,GR(E/A)YHOUND,45,S[AIN]T+BERNARD,40,DOBERMAN[+PINSCHER],31,HUSKY,24,YORK(Y/SHIRE+TERRIER),21,LABRADOR[+RETRIEVER],14,LHASA+APSO,7
9,"AT WHAT AGE DOES A WOMAN START TO LOOK LIKE AN ""OLDER WOMAN""",83,-1,-1,40,30,45,27,50,24,35,21,30,18,55,15,60,12,25,9,65,6
8,NAME YOUR LEAST FAVORITE MONTH,93,90,135,JAN[UARY],44,FEB[RUARY],39,SEP[TEMBER],34,MAR[CH],29,APR[IL],24,AUG[UST],19,JULy,14,NOV[EMBER],9
8,HOW MANY HOURS ARE THERE IN A HOUSEWIFE'S WORKDAY,86,-1,-1,12,28,16,25,24,22,15,19,18,16,9,13,4,10,10,7
2,NAME SOMETHING THAT HAS YOUR BIRTH DATE ON IT,100,54,81,[DRIVER[']S+]LICENSE,26,BIRTH+CERTIFICATE,15
5,AFTER HOW MANY YEARS OF MARRIAGE SHOULD A COUPLE HAVE A CHILD,96,-1,-1,2,22,3,19,1,16,5,13,4,10
7,WHAT'S THE MOST DAYS YOU'VE EVER GONE WITHOUT BATHING,98,-1,-1,2,26,3,23,7,20,1,17,6,14,4,11,5,8
12,HOW MUCH IN DOLLARS DOES THE AVERAGE FAMILY SPEND A WEEK ON FOOD,95,-1,-1,50,34,100,31,60,28,75,25,70,22,80,19,150,16,30,13,125,10,200,7,35,4
8,HOW MANY HOURS EACH DAY DO YOU WATCH TV,96,-1,-1,4,28,5,25,3,22,2,19,6,16,8,13,1,10,10,7
8,"HOW MANY DAYS IS ""TOO LONG"" FOR A HOUSEGUEST TO VISIT",95,-1,-1,7,28,14,25,30,22,3,19,21,16,4,13,8,10,10,7
3,NAME SOMETHING THAT HAS A SHARP EDGE,94,38,57,KNIFE,18,RAZOR,15,SAW,12
3,NAME AN EXPENSIVE FLOWER,97,42,63,ROSE,20,OR(CH/K)ID,17,CARNATION,12
4,NAME A PART OF A TREE,100,42,63,TRUNK,20,BRANCH,17,LEAVES,14,BARK,11
3,NAME A BRAND OF TUNA,100,66,99,STAR+KIST,32,CHICKEN[+OF]+SEA,27,BUMBLE+BEE,14
4,NAME A PLACE KIDS ARE TOLD TO BEHAVE,96,62,93,CHURCH,30,SCHOOL,27,RESTAURANT,24,[SUPER+]MARKET/[GROCERY+]STORE/GROCERY,21
3,NAME A GOOD PET FOR AN APARTMENT,91,38,57,BIRD,18,FISH,15,CAT,12
3,NAME SOMETHING YOU DO THAT GIVES YOU A BACKACHE,52,44,66,LIFTING,21,GARDENING/YARD+WORK,18,SHOVELING,12
5,NAME A PART OF THE FACE,99,48,72,NOSE,23,EYES,20,MOUTH/LIP,17,CHEEK,13,FOREHEAD,10
4,NAME A SIZE OF BED,100,44,66,KING,21,QUEEN,18,TWIN,15,DOUBLE/FULL,12
4,NAME A SPORT THAT TAKES PLACE IN THE AIR,99,46,69,SKYDIVING,22,GLIDING,19,FLYING,16,KITE+FLYING,13
12,NAME A BORING PET,79,70,105,FISH,34,SNAKE,31,TURTLE,28,BIRD,25,CAT,22,GOPHER,19,PIG,16,SNAIL,13,WORM,10,ANTEATER,7,BEAR,4
3,NAME ONE OF COLUMBUS' SHIPS,100,42,63,NINA,20,SANTA+MARIA,17,PINTA,12
3,NAME AN INSTRUMENT IN COUNTRY MUSIC,97,40,60,GUITAR,19,BANJO,16,FIDDLE/VIOLIN,13
3,NAME A SPORT PLAYED ON A FIELD,100,38,57,FOOTBALL,18,BASEBALL,15,SOCCER,12
10,NAME A MOVING VAN COMPANY,88,74,111,ALLIED,36,MAYFLOWER,33,GLOBAL,30,U+HAUL,27,ATLAS,22,BEKINS,19,UNITED,16,AMERICAN,13,RED+BALL,10,WORLDWIDE,5
3,NAME AN ANIMAL THAT RESEMBLES A HORSE,99,42,63,DONKEY/MULE/ASS,20,ZEBRA,15,DOG,12
7,NAME SOMETHING FAMILIES DO IN THE CAR ON LONG TRIPS,96,66,99,SING,32,SLEEP,29,PLAY[+GAMES],26,ARGUE/YELL/FIGHT,19,TALK,14,EAT,11,READ,8
6,HOW MANY TIMES PER YEAR DO PEOPLE GET SICK,94,-1,-1,2,24,3,21,1,18,4,15,5,12,0,9
7,HOW MUCH IN DOLLARS DOES A LARGE PIZZA COST,69,-1,-1,10,26,8,23,15,20,9,17,5,14,6,11,4,8
7,HOW MANY TIMES PER YEAR DO YOU GO TO THE MOVIES,74,-1,-1,3,26,6,23,10,20,5,17,12,14,2,11,15,8
3,"NAME SOMETHING A WOMAN MIGHT RECEIVE FROM AN ""ANONYMOUS ADMIRER""",97,42,63,FLOWERS,20,LETTER/NOTE,17,CARD/VALENTINE,13
3,NAME THE MOST LUXURIOUS METHOD OF TRAVEL,100,54,81,[AIR]PLANE,26,SHIP/BOAT/YACHT/YAT,21,LUXURY+CAR/LIMOUSINE,15
6,NAME SOMETHING FEATHERS ARE USED FOR,94,62,93,PILLOWS,30,HATS,27,DUSTERS,24,TICKLING,21,FLOWER+ARR[ANGEMENTS],18,HEADDRESS,9
8,HOW MANY MINUTES DOES IT TAKE TO DO A CROSSWORD PUZZLE,90,-1,-1,60,28,30,25,120,22,20,19,45,16,15,13,180,10,100,7
4,"NAME THE AGE WHEN A MAN IS ""OVER THE HILL""",58,-1,-1,60,20,65,17,50,14,70,11
5,NAME A JUNK FOOD,95,56,84,POTATO+CHIP,27,CANDY,22,TWINKIES,19,FRIES/FRENCH+FRIES,16,PIZZA,10
3,"NAME THE MONTH YOU DO YOUR ""SPRING CLEANING""",96,46,69,APR[IL],22,MAR[CH],17,MAY,12
7,NAME THE ANIMAL YOU WOULD LIKE TO BE REINCARNATED AS,95,56,84,DOG,27,CAT,24,BIRD/PARROT,21,HORSE,17,LION,14,BEAR,11,DEER,8
12,NAME THE STATE WHERE YOU'D LEAST LIKE TO LIVE,80,100,150,ALASKA/AK,49,NEW+YORK/NY,45,CALIFORNIA/CA,39,NEW+JERSEY/NJ,35,GEORGIA/GA,29,MAINE/ME,25,MISSISSIPPI/MS,21,MONTANA/MT,17,OKLAHOMA/OK,13,TEXAS/TX,9,FLORIDA/FL,5
4,NAME A HOLIDAY WHEN YOU DRESS UP,97,62,93,EASTER,30,HALLOWEEN,27,(CHRIST/X+)MAS,24,NEW+YEAR[']S,17
12,"NAME A MUSICAL INSTRUMENT WITH A ""HAUNTING"" SOUND",90,72,108,ORGAN,35,OBOE,32,VIOLIN,29,FLUTE,26,HARP,23,CELLO,20,BAGPIPES,17,TUBA,14,BASSOON/BASOON,11,BUGLE,7,PIANO,4
12,HOW MUCH IS YOUR WEEKLY GROCERY BILL IN DOLLARS,91,-1,-1,100,34,50,31,75,28,60,25,40,22,70,19,80,16,30,13,65,10,20,7,45,4
7,NAME A FOOD BACHELORS MAKE,96,66,99,TV+DINNERS,32,SANDWICHES,27,STEAK,24,SPAGHETTI/MACARONI/PASTA,21,SOUP,16,CANNED+FOOD,13,PIZZA,8
8,NAME SOMETHING WRAPPED IN CELLOPHANE,91,60,90,CANDY/SWEETS,29,MEAT,25,CIGARETTES,22,CHEESE,19,BREAD,16,FRUIT,13,LETTUCE,10,SANDWICH,7
