4,NAME A MEAL,99,42,63,DINNER,20,BREAKFAST,17,SUPPER,14,LUNCH,11
3,NAME SOMETHING YOU BUTTON UP,98,42,63,SHIRT/BLOUSE,20,COAT/JACKET,16,SWEATER,12
4,NAME AN OCCUPATION ASSOCIATED WITH CARS,83,94,141,MECHANIC,46,(TAXI/CAB)+DRIVER,43,[CAR+]SALES*,34,RACE[+CAR]+DRIVER,21
7,NAME SOMETHING IN A CHILD'S SCHOOLBAG,98,64,96,PENCILS/PENS,31,BOOKS,27,CRAYONS,24,LUNCH/SNACKS,21,NOTEBOOK/TABLET/PAPER/PADS,17,HOMEWORK,11,RULER,8
6,NAME THE MONTH YOU GET THE MOST COLDS,98,74,111,JAN[UARY],36,DEC[EMBER],31,FEB[RUARY],26,MAR[CH],21,NOV[EMBER],16,APR[IL],11
10,HOW MANY BIG FIGHTS DO YOU HAVE WITH YOUR SPOUSE IN A YEAR,97,-1,-1,2,32,3,29,5,26,1,23,10,20,0,17,6,14,4,11,12,8,364,5
4,HOW MANY TIMES A WEEK DO YOU WATER YOUR HOUSEPLANTS,96,-1,-1,1,20,2,17,3,14,7,11
9,NAME SOMETHING SOFT,83,66,99,COTTON,32,PILLOW,29,FEATHERS,26,BABY,23,MARSHMALLOW,20,FUR,17,VELVET,14,BUNNY/RABBIT,11,TISSUE/KLEENEX,7
8,NAME SOMETHING THAT'S EXPENSIVE TO REPLACE,91,78,117,CAR/AUTO*,38,JEWELRY/DIAMONDS,32,HOUSE/HOME,28,TV[+SET]/TELEVISION,24,ANTIQUES,16,CHINA,13,FURNITURE,10,WINDOW,7
12,NAME A STATE WHERE YOU'D EXPECT TO SEE LOTS OF WILDLIFE,88,92,138,ALASKA/AK,45,COLORADO/CO,41,MONTANA/MT,37,WYOMING/WY,33,FLORIDA/FL,29,ARIZONA/AZ,25,MAINE/ME,21,OREGON/OR,17,TENNESSEE/TN,13,TEXAS/TX,9,WASHINGTON/WA,5
4,NAME A PART OF A PLANT,99,44,66,LEAF,21,STEM,18,ROOT,15,FLOWER/BLOSSOM,12
5,HOW MANY MINUTES DOES IT TAKE TO EAT BREAKFAST,99,-1,-1,15,22,10,19,20,16,30,13,5,10
12,APPROXIMATELY HOW MUCH DID YOU PAY FOR YOUR FIRST CAR,75,-1,-1,500,34,1000,31,2000,28,3000,25,400,22,2500,19,3500,16,200,13,4000,10,75,7,100,4
3,NAME A COLOR THAT GREEN GRASS BECOMES,97,38,57,BROWN,18,YELLOW,15,WHITE,12
4,NAME THE BUSIEST DAY OF THE WEEK,99,58,87,FRI[DAY],28,MON[DAY],23,SAT[URDAY],18,TUE[SDAY],13
12,NAME A BREED OF DOG,77,132,198,POODLE/* POODLE,65,GERM+SHEP/SHEPHERD/SHEPERD/GERMAN SHEP,59,SPANIEL/COCKER,51,COLLIE,47,TERRIER,44,DACHSHUND/DAKSHUND,41,IRISH+SET[TER],37,CHIHUAHUA,28,S[AIN]T+BERNARD,25,BEAGLE,16,LABRADOR/[*+]RETRIEVER,13
7,HOW FEW HOURS OF SLEEP CAN YOU GET BY ON,99,-1,-1,6,26,5,23,4,20,3,17,2,14,7,11,8,8
9,NAME SOMETHING BESIDES A CAR THAT HAS A MOTOR,92,74,111,BOAT,36,MOTORCYCLE/MOTORBIKE,33,LAWN+MOWER,29,[AIR]PLANE,24,BUS,19,REFRIGERATOR/FRIDGE,16,DRYER,12,TRACTOR,9,TRUCK,6
3,NAME SOMETHING PEOPLE PUT ON BREAKFAST CEREAL,100,42,63,MILK,20,SUGAR,17,FRUIT/BANANAS/STRAWBERRIES,14
11,HOW MANY CARDS DO YOU USUALLY RECEIVE ON YOUR BIRTHDAY,96,-1,-1,10,34,5,31,6,28,3,25,2,22,4,19,12,16,7,13,15,10,20,7,25,4
12,NAME A STATE IN THE MIDWEST,95,92,138,KANSAS/KS,45,ILLINOIS/IL,41,IOWA/IA,37,MISSOURI/MO,33,NEBRASKA/NE,29,OKLAHOMA/OK,25,INDIANA/IN,21,MINNESOTA/MN,17,WYOMING/WY,13,SOUTH DAKOTA/SD,9,WISCONSIN/WI,5
7,NAME SOMETHING THAT'S FUN TO RIDE ON,98,88,132,ROLL+COAST/ROLLER+COASTER,43,HORSE,35,MOTORCYCLE,32,FERRIS+WHL/FERRIS+WHEEL,29,CAROUSEL/MERRY+GO+ROUND,21,SKATEBOARD,11,SWING,8
4,NAME A FRUIT TREE,86,42,63,APPLE,20,PEACH,17,CHERRY,14,ORANGE,11
9,NAME AN INGREDIENT IN CASSEROLES,93,90,135,MACARONI/NOODLES/PASTA,44,MEAT,39,CHEESE,36,TUNA+[FISH],33,EGGS,24,MILK,21,TOM[ATO]+SAUCE,18,CHICKEN,9,SOUP,6
8,NAME SOMETHING LITTLE BOYS LIKE THAT LITTLE GIRLS DON'T,93,62,93,FROGS/TOADS,30,SNAKES,26,BUGS,23,WORMS,20,SPORTS/FISHING,17,TRUCKS,13,CARS,10,GUNS,7
11,NAME AN OCCUPATION THAT USES A TRUCK,90,104,156,(TRASH/GARBAGE)+COLLECT,51,MOVER/MOVING,42,DELIVERY,38,TRUCK+DRIV(ER/ING),35,FARMER/FARMING,26,HAULING,22,PLUMB(ER/ING),19,MILKMAN,14,TOWING/WRECKER,11,FURNITURE,7,LANDSCAPING,4
12,HOW MANY DIFFERENT CHANNELS DOES YOUR TV GET,85,-1,-1,7,34,8,31,10,28,12,25,6,22,5,19,15,16,14,13,20,10,4,7,24,4
4,NAME AN ILLNESS AN ENTIRE FAMILY MIGHT CATCH,98,50,75,FLU,24,COLD,21,MEASLES,18,STREP[+THROAT],15
8,WHAT'S THE MOST YOU'D PAY FOR A NEW CAR,91,-1,-1,10000,28,8000,25,6000,22,7000,19,9000,16,5500,13,12000,10,15000,7
3,"NAME ONE OF THE ""BEATLES""",98,92,138,[J[OHN]+]LENNON/JOHN,45,[R[INGO]+]STARR/RINGO,33,[P[AUL]+]MCCARTNEY/PAUL,21
10,HOW MANY MONTHS DOES A HIGH SCHOOL ROMANCE LAST,97,-1,-1,6,32,12,29,3,26,24,23,1,20,36,17,8,14,9,11,2,8,18,5
5,NAME SOMETHING A PRIEST WEARS,97,52,78,FROCK/ROBE/CASSOCK,25,COLLAR,20,CROSS/CRUCIFIX,17,ROSARY,13,PANTS,10
7,NAME THE COLOR OF CARPET IN YOUR LIVING ROOM,93,56,84,GREEN,27,BROWN,24,GOLD,21,BEIGE/TAN,18,RUST,14,BLUE,11,RED,8
9,HOW MANY POUNDS DOES A FOOTBALL PLAYER WEIGH,91,-1,-1,200,30,225,27,250,24,210,21,220,18,230,15,180,12,240,9,185,6
9,HOW MANY BOOKS DO YOU BUY IN A YEAR,87,-1,-1,5,30,10,27,2,24,12,21,4,18,3,15,6,12,15,9,0,6
7,HOW MANY GLASSES OF WATER DO YOU DRINK EACH DAY,97,-1,-1,2,26,3,23,4,20,1,17,6,14,5,11,8,8
10,NAME A SPORT THAT THE WHOLE FAMILY CAN PLAY TOGETHER,95,68,102,BASEBALL/SOFTBALL,33,BOWLING,29,VOLLEYBALL,26,TENNIS,23,GOLF,20,BADMINTON,17,CROQUET,14,SWIMMING,11,FOOTBALL,8,FRISBEE,5
9,HOW MANY YEARS HAVE YOU WORKED AT YOUR PRESENT JOB,78,-1,-1,5,30,10,27,20,24,15,21,2,18,3,15,7,12,8,9,30,6
3,NAME YOUR FAVORITE TV NETWORK,97,38,57,ABC,18,NBC,15,CBS,12
8,NAME THE AGE WHEN YOU GOT YOUR FIRST JOB,97,-1,-1,16,28,15,25,17,22,14,19,12,16,13,13,18,10,19,7
9,HOW MANY YEARS HAVE YOU KNOWN YOUR BEST FRIEND,77,-1,-1,10,30,20,27,5,24,15,21,25,18,30,15,12,12,13,9,40,6
8,HOW MUCH DOES A NEW WARDROBE COST,91,-1,-1,1000,28,500,25,2000,22,3000,19,5000,16,1500,13,2500,10,300,7
3,NAME A PLACE THAT GETS VERY STEAMY,93,56,84,BATHROOM/SHOWER,27,SAUNA,23,STEAM+[BATH/ROOM],20
4,NAME THE SEASON YOU MOST LOOK FORWARD TO,100,44,66,SPRING,21,SUMMER,18,FALL/AUTUMN,15,WINTER,11
2,"NAME AN ""EXTRA"" PEOPLE WANT ON A NEW CAR",93,46,69,AIR COND/AIR+CONDITION,22,RADIO/STEREO/TAPE/MUSIC,16
7,WHAT'S THE MOST FLIGHTS OF STAIRS YOU'VE EVER CLIMBED AT ONE TIME,82,-1,-1,5,26,10,23,6,20,3,17,4,14,8,11,20,8
4,NAME THE HOLIDAY WHEN YOU THINK FLORISTS DO THE MOST BUSINESS,100,56,84,MOTHERS+DAY,27,VALENTINE[']S,22,EASTER,17,CHRISTMAS/X+MAS,14
7,WHAT'S THE MOST MONEY YOU'D PAY FOR SHOES,81,-1,-1,50,26,30,23,40,20,25,17,35,14,45,11,20,8
6,NAME THE HOUR AT WHICH YOU GET DRESSED ON SUNDAY,92,-1,-1,9,24,10,21,11,18,12,15,8,12,7,9
8,NAME A REAL ANIMAL SEEN IN SCARY DREAMS,88,58,87,SNAKE,28,BEAR,25,LION,22,WOLF,19,DOG,16,BAT,13,GORILLA,10,CAT,7
10,HOW MANY LETTERS DO YOU WRITE PER YEAR,69,-1,-1,10,32,25,29,2,26,12,23,20,20,50,17,6,14,15,11,100,8,0,5
5,HOW MANY MILES DO MOST PEOPLE TRAVEL TO WORK EACH DAY,89,-1,-1,10,22,5,19,15,16,20,13,2,10
5,NAME THE AGE WHEN A BOY'S VOICE CHANGES,99,-1,-1,13,22,14,19,12,16,15,13,16,10
6,NAME A COLOR OF POOL BALLS,97,50,75,BLACK,24,WHITE,21,RED,18,YELLOW,15,BLUE,12,GREEN,9
10,AT WHAT AGE DO CHILDREN BECOME INTERESTING TO TALK WITH,90,-1,-1,10,32,12,29,4,26,3,23,5,20,6,17,16,14,13,11,7,8,8,5
8,HOW MANY MINUTES DOES IT TAKE BEFORE YOU'RE REALLY AWAKE IN THE MORNING,99,-1,-1,15,28,10,25,5,22,30,19,2,16,60,13,1,10,20,7
9,"AT WHAT AGE DO MANY PEOPLE BEGIN A ""SECOND CHILDHOOD""",87,-1,-1,40,30,50,27,70,24,75,21,45,18,60,15,65,12,80,9,30,6
6,NAME A PLACE CHILDREN THINK MONSTERS HIDE,92,72,108,CLOSETS,35,UNDER+[THE+]BED,32,BASEMENTS/CELLAR,19,CAVES,15,WOODS,12,ATTICS,9
2,NAME A WAY PEOPLE REWARD THEIR DOG,98,60,90,FOOD/TREAT,29,PAT+ON+HEAD/PET[TING]/PAT[HEAD],25
4,HOW MANY MINUTES DO KIDS SPEND ON THEIR HOMEWORK EACH NIGHT,95,-1,-1,60,20,30,17,120,14,15,11
8,NAME A HIGH IQ SCORE,74,-1,-1,150,28,140,25,160,22,180,19,120,16,135,13,130,10,100,7
6,HOW MANY ENEMIES DO YOU HAVE,97,-1,-1,0,24,2,21,1,18,3,15,4,12,5,9
4,NAME ANY US COIN,86,52,78,DIME,25,QUARTER,22,PENNY,19,SLVR+DOLLAR/SILVER+DOLLAR,16
5,HOW MANY MINUTES DO YOU SPEND AT A SUPERMARKET,94,-1,-1,60,22,30,19,45,16,90,13,120,10
6,HOW MUCH CASH IN DOLLARS DO YOU CARRY AROUND WITH YOU,87,-1,-1,20,24,10,21,5,18,30,15,15,12,0,9
5,NAME THE AGE WHEN CHILDREN SHOULD START SUPPORTING THEMSELVES,92,-1,-1,18,22,21,19,20,16,19,13,22,10
10,NAME A SOUND YOU REALLY HATE,71,116,174,NAILS[+ON]+BOARD/FINGERNAILS/BLACKBOARD,57,SIREN/WHISTLE,42,ROCK+MUSIC/DISCO,38,SCREECH,32,[AIR]PLANES,29,ALARM+CLOCK/ALARM,24,BUZZER,18,DRILL,15,BARK/DOG,12,NOISY+KIDS/CHILDREN,8
9,NAME SOMETHING ON A NEW CAR THAT GOES BAD QUICKLY,71,84,126,TIRES,41,BRAKES,38,CLOCK,35,AIR+COND/AIR+CONDITION[ER/ING],32,BODY,18,CARBURETOR,15,MUFFLER,12,LIGHTS,9,WIPERS,6
9,NAME SOMETHING THAT CLICKS,86,64,96,LOCK,31,WATCH,28,CAMERA,25,PEN,22,SWITCH,19,LATCH,16,FINGERS,13,GUN,10,SHOE/HEEL,7
9,"NAME A TYPE OF PRODUCT THAT'S MADE IN A ""DAINTIER"" STYLE FOR LADIES",67,76,114,DEODORANT,37,PANTS/JEANS,34,[ELECTRIC+]RAZOR,30,SOAP,23,UMBRELLA,20,HANKY/HANDKERCHIEF,17,GLOVES,13,PERFUME/COLOGNE,10,SHOES,6
5,NAME SOMETHING YOU OCCASIONALLY SPLURGE ON,90,64,96,DINNER/ENTERTAINMENT/FOOD/MEALS,31,CLOTHES,25,SWEETS/DESSERT,22,LOVED+ONES/RELATIVES,18,VACATION/TRAVEL/HOLIDAY,12
5,NAME SOMETHING YOU SEE IN THE SKY,80,46,69,CLOUDS,22,STARS,19,SUN,16,MOON,13,SMOG,10
3,NAME A SPORT THAT HAS A HALL OF FAME,99,38,57,BASEBALL,18,FOOTBALL,15,BASKETBALL,12
6,NAME A PLACE PEOPLE SPEND HOURS JUST DAYDREAMING,85,50,75,PARK,24,SCHOOL,21,HOME,18,BEACH,15,CAR,12,WORK,9
2,NAME SOMETHING YOU HAVE SPARE KEYS FOR,100,34,51,CAR,16,HOUSE,13
9,HOW MANY HOURS A DAY DOES A TOP EXECUTIVE WORK,94,-1,-1,10,30,8,27,6,24,12,21,4,18,5,15,14,12,2,9,9,6
7,HOW OLD WERE YOU IN YOUR FIRST MEMORIES OF YOURSELF,95,-1,-1,3,26,5,23,4,20,6,17,2,14,7,11,10,8
2,NAME SOMETHING COUPLES FIGHT ABOUT EVEN AFTER THE DIVORCE,97,38,57,KIDS/CHILDREN,18,ALIMONY/MONEY,14
2,NAME SOMETHING ANIMALS DO WHEN THEY'RE ANGRY,93,42,63,BITE/FIGHT,20,BARK/GROWL/YELP/HISS,16
8,AT WHAT HOUR ARE YOU THE MOST ENERGETIC,79,-1,-1,10,28,12,25,9,22,2,19,8,16,1,13,11,10,3,7
10,HOW MANY MINUTES DOES IT TAKE YOU TO GET UP AFTER THE ALARM GOES OFF,95,-1,-1,10,32,5,29,15,26,1,23,20,20,30,17,2,14,3,11,60,8,0,5
3,NAME SOMETHING USED-CAR SALESMEN LIE ABOUT,78,64,96,MILEAGE,31,[CAR[']S+]CONDITION,28,[FORMER/PREVIOUS+]OWNERS,17
4,NAME A KIND OF PLACE YOU GET HUNGRY JUST BY SMELLING THE FOOD,99,42,63,BAKERY,20,RESTAURANT,17,FAIR,14,KITCHEN,11
7,NAME SOMETHING THAT CAUSES ACHES AND PAINS,73,70,105,EXERCISE/JOGGING,34,FLU/COLD,30,ARTHRITIS,26,ACCIDENT,23,[BAD+]WEATHER,20,TOOTH+ACHE,13,WORK,8
8,ON A SCALE OF 1 TO 10 HOW IMPORTANT ARE LOOKS IN A PARTNER,94,-1,-1,5,28,7,25,8,22,6,19,2,16,4,13,1,10,10,7
7,HOW MUCH IN DOLLARS DOES IT COST TO HAVE A BABY,81,-1,-1,1000,26,2000,23,1500,20,500,17,1200,14,3000,11,5000,8
7,NAME SOMETHING PEOPLE DO TO GET A BREAK ON THEIR TAXES,85,132,198,CHEAT/LIE,65,DONATE[+MONEY]/GIVE[+TO+]CHARITY,61,HAVE+KIDS/CHILDREN/DEPENDENTs,45,[BUY+](PROPERTY/REAL+ESTATE),36,DEDUCTIONS/BUSINESS,17,EXEMPTIONS,13,GET+MARRIED,10
6,ON A SCALE OF 1 TO 10 HOW NICE ARE YOU,96,-1,-1,8,24,7,21,10,18,9,15,5,12,6,9
6,NAME THE AGE AT WHICH A WOMAN SHOULD GET MARRIED,90,-1,-1,25,24,21,21,22,18,23,15,24,12,20,9
7,NAME SOMETHING ABOUT WHICH MOST MEN ARE BOYS AT HEART,83,68,102,SPORTS/FISHING,33,TOYS,29,CARS/RACES,26,(CHRIST/X+)MAS,22,PRESENTS/GIFTS,15,GAMES,11,HOBBIES,8
7,HOW MANY PEOPLE DO YOU TRULY DISLIKE,87,-1,-1,3,26,5,23,0,20,2,17,1,14,10,11,4,8
3,WOULD YOU RATHER LIVE IN THE PAST PRESENT OR FUTURE,100,38,57,PRESENT,18,PAST,15,FUTURE,12
3,"GIVE ME ANOTHER WORD FOR ""CRY""",97,38,57,WEEP,18,SOB,15,BAWL,12
8,NAME A WOMAN'S HOBBY,81,60,90,SEWING,29,KNITTING,26,TENNIS,23,MEN,20,GOLF,17,BOWLING,14,NEEDLEPOINT/EMBROIDERY,11,BRIDGE,7
11,NAME A SHORT-HAIRED BREED OF DOG,96,104,156,DACHSHUND/DAKSHUND,51,BEAGLE,47,CHIHUAHUA,44,POODLE/* POODLE,41,TERRIER,35,BOXER,32,DOBERMAN[+PINSCHER],29,GER+SHEP/SHEPhERD,22,BASSET[+HOUND],14,BULLDOG,7,DALMATIAN,4
10,NAME SOMETHING YOU SEE IN NEWSPAPERS,97,76,114,ADS,37,HEADLINES,34,COMICS/CARTOON/FUNNIES,31,SPORTS,26,EDITORIALS,23,WEATHER,20,NEWS,17,FRONT+PAGE,14,OBITUARIES,9,TITLE/MASTHEAD,6
12,NAME A STATE THAT YOU RARELY HEAR ABOUT,79,124,186,RHODE+ISL[AND]/RI,61,MAINE/ME,51,NORTH+DAKOTA/ND,47,IOWA/IA,41,NEW+HAMP[SHIRE]/NH,37,IDAHO/ID,27,NEW+MEXICO/NM,23,OREGON/OR,17,ARKANSAS/AR,13,CALIFORNIA/CA,9,DELAWARE/DE,5
3,NAME A COMMON COLOR FOR SWEATSHIRTS,95,42,63,GR(A/E)Y,20,BLUE,15,WHITE,12
3,NAME ONE OF THE THREE BEARS,100,42,63,MAMA/MOMMA,20,PAPA/POPPA,16,BABY,12
9,NAME A FOOD THAT SPOILS EASILY,96,62,93,MILK,30,MEAT,27,FISH,24,FRUIT,21,CREAM,18,POTATO SALAD,15,BREAD,12,CHEESE,9,MAYONNAISE,6
4,NAME SOMETHING YOU CAN DO TO KEEP YOUR HEART IN GOOD SHAPE,92,80,120,RUN/JOG,39,EXERCISE,35,EAT+RIGHT/(WATCH/LOSE)+WEIGHT,32,DON[']T+SMOKE/STOP+SMOKING,20
7,HOW MANY PUPPIES ARE IN A LITTER,99,-1,-1,6,26,5,23,4,20,8,17,7,14,3,11,10,8
7,NAME SOMETHING THAT HAS HORNS,91,56,84,BULL/COW,27,GOAT,23,CARS,20,ANTELOPE,17,DEER,14,DEVIL,11,ELK,8
9,HOW MANY TIMES A DAY DO YOU GET KISSED,99,-1,-1,2,30,3,27,5,24,10,21,1,18,0,15,4,12,6,9,20,6
8,NAME SOMETHING FOUND IN HAWAII,88,128,192,PINEAPPLEs,63,L(EI/AY)S,58,FLOWERs/OR(K/CH)IDs,53,SURFERs,41,BEACH[ES],36,HULA+GIRLs,31,PALM+TREEs,22,GRASS+SKIRTs,13
7,HOW MANY NIGHTS A WEEK DO YOU STAY HOME AND WATCH TV,98,-1,-1,5,26,4,23,3,20,1,17,2,14,6,11,0,8
9,NAME A FISH IN THE OCEAN,88,62,93,SHARK,30,TUNA,27,FLOUNDER,24,SALMON,21,BASS,18,SWORDFISH,15,WHALE,12,BARRACUDA,9,HALIBUT,6
7,NAME A NUTRITIOUS BREAKFAST FOOD,99,60,90,EGGS,29,JUICE/* JUICE,26,MILK,20,CEREAL,17,BACON,14,FRUIT,11,TOAST,8
6,HOW MANY TIMES A YEAR DO YOU GIVE A PARTY,91,-1,-1,2,24,3,21,1,18,4,15,0,12,5,9
4,NAME A KIND OF JACKET,60,44,66,STRAIGHT/STRAIT,21,SPORTS,17,WINDBREAKER,14,YELLOW,11
7,NAME SOMETHING YOU WEAR WHEN YOU DRESS CASUALLY,89,72,108,[BLUE+]JEANS/DUNGAREES,35,SNEAKERS/TENNIS+SHOES,27,SLACKS/PANTS,21,SWEATS,17,SWEATER,14,SHIRT,11,SHORTS,8
3,NAME A COLOR OF PARAKEETS,97,38,57,GREEN,18,YELLOW,15,BLUE,12
4,NAME SOMETHING FOUND AT THE NORTH POLE,86,62,93,SNOW,30,ICE,27,SANTA[+CLAUS],24,POLAR+BEARs,17
5,NAME A LANGUAGE YOU LEARN IN SCHOOL,100,46,69,SPANISH,22,FRENCH,19,ENGLISH,16,LATIN,13,GERMAN,10
4,NAME THE BEST TV NIGHT OF THE WEEK,78,58,87,THU[RSDAY],28,SUN[DAY],23,FRI[DAY],18,SAT[URDAY],13
4,"BESIDES ""BEST REGARDS"" NAME ANOTHER WAY TO CLOSE A LETTER",92,58,87,SINCERELY,28,SINC[ERELY]+YOURS,25,YOURS+TRULY,16,LOVE,11
5,NAME SOMETHING THAT'S HARD TO WASH OFF YOUR HANDS,88,54,81,GREASE/OIL,26,PAINT,22,INK,19,SAP/PITCH,16,GLUE/PASTE/ADHESIVE,12
7,NAME A FOOD WITH A TERRIBLE ODOR,88,54,81,CHEESE,26,FISH,23,CABBAGE,20,ONION,17,GARLIC,14,SAUERKRAUT,11,LIVER,8
6,NAME A PERFUME,66,54,81,CHANEL,26,GEORGIO,23,OPIUM,20,ESTEE+LAUDER,17,OBSESSION,12,PASSION,9
6,NAME A COLD STATE BESIDES ALASKA,85,74,111,MINNESOTA/MN,36,MONTANA/MT,32,MAINE/ME,28,N[ORTH]+DAKOTA/ND,24,MICHIGAN/MI,14,WASHINGTON/WA,10
6,NAME THE FIRST PART OF YOUR BODY THAT YOU SOAP UP IN THE SHOWER,92,54,81,ARMS,26,FACE,23,CHEST,20,HAIR/HEAD,17,HANDS,13,ARMPITS/UNDERARMS,10
5,NAME SOMETHING PEOPLE DRINK WITH DINNER,96,54,81,WINE,26,MILK,23,WATER,20,[ICED+]TEA,17,COFFEE,10
5,NAME SOMETHING PEOPLE WEAR THAT'S WHITE,91,68,102,UNDERWEAR,33,SHIRT/BLOUSE,30,SO(CKS/X),26,WEDDING+[GOWN/DRESS],21,UNIFORM,10
6,NAME A CANNED VEGETABLE,98,66,99,CORN,32,BEANs,29,PEAs,24,SPINACH,19,TOMATO[ES],16,CARROTs,11
5,NAME SOMETHING SOLD AT BASEBALL GAMES,95,60,90,HOT+DOGS/FRANKS,29,PEANUTS,23,BEER,20,POPCORN,17,SODA+POP/SODA/POP,14
5,BESIDES A CLASSROOM NAME A ROOM IN SCHOOLS,85,56,84,GYM[NASIUM],27,CAFETERIA/LUNCH+ROOM,22,BATHROOM,16,LIBRARY,13,AUDITORIUM,10
6,NAME A FOOD THAT YOU FRY,98,50,75,CHICKEN,24,POTATOES,21,FISH,18,EGGS,15,HAMBURGER,12,BACON,9
5,NAME A GENTLE ANIMAL,88,46,69,CAT,22,RABBIT,19,LAMB,16,DOG,13,HORSE,10
3,NAME A VOICE IN A BARBERSHOP QUARTET,100,38,57,TENOR,18,BASS,15,BARITONE,12
4,NAME SOMETHING YOU DRINK WHEN YOU DON'T FEEL WELL,90,60,90,TEA,29,MEDICINE,26,SODA+POP/SODA/COKE/PEPSI/POP,23,JUICE/* JUICE,14
4,WHERE WOULD MOST WOMEN WANT TO SUBTRACT AN INCH,100,50,75,WAIST,24,HIPS,21,BEHIND/REAR/BUTT[OCKS],18,THIGHS,11
6,NAME A FOOD THAT SHOULD BE BOUGHT FRESH,96,52,78,FISH/SEAFOOD,25,VEGETABLES,21,FRUIT,18,BREAD,15,MEAT,12,MILK,9
5,NAME A COMMON COLOR FOR FLOWERS,97,46,69,RED,22,YELLOW,19,PINK,16,WHITE,13,BLUE,10
4,NAME THE SPORT WITH THE HIGHEST-PAID ATHLETES,97,42,63,FOOTBALL,20,BASEBALL,17,BASKETBALL,14,GOLF,11
5,NAME AN INSURANCE COMPANY,67,94,141,PRUDENTIAL,46,STATE+FARM,43,ALLSTATE,38,MUT[UAL]+[OF+]OMAHA,35,FARMERS,10
6,NAME AN OCCUPATION YOU'D HATE YOUR NEIGHBOR TO HAVE,61,62,93,MUSICIAN,30,GARBAGEMAN,27,POLICEMAN,24,MORTICIAN/FUNERAL+DIRECTOR,21,MECHANIC,15,TAX+COLLECTOR/IRS,12
5,NAME A COUNTRY WHERE AUTO-RACING IS A BIG SPORT,97,72,108,USA/UNITED+STATES/AMERICA,35,FRANCE,28,ITALY,25,MONACO,22,ENGLAND/[GREAT+]BRITAIN/UK/UNITED+KINGDOM,19
5,NAME SOMETHING YOU BUY BECAUSE IT'S WARM AND SNUGGLY,83,58,87,BLANKET/COMFORTER,28,PET/DOG/CAT/PUPPY/KITTEN,24,COAT/JACKET,17,ROBE,13,SWEATER,10
6,NAME A MEMBER OF THE WEDDING PARTY,95,102,153,BRIDE,50,GROOM,47,BEST+MAN,44,(MAID/MATRON)+[OF+]HONOR,39,BRIDESMAID,14,FLOWER+GIRL,11
5,NAME A DEVICE YOU LOOK THROUGH,95,52,78,TELESCOPE,25,BINOCULARS,22,MICROSCOPE,19,MAGNIFIER/MAGNIFYING+GLASS,16,EYEGLASSES,10
5,NAME A SPORT THAT DOES NOT HAVE CHEERLEADERS,85,46,69,BASEBALL,22,HOCKEY,19,TENNIS,16,GOLF,13,SOCCER,10
4,NAME THE MONTH WHEN YOU SEE THE FIRST ROBIN,98,54,81,APR[IL],26,MAR[CH],21,MAY,16,FEB[RUARY],13
4,NAME SOMETHING PEOPLE WEAR TWO OF AT THE SAME TIME,98,52,78,SHOES,25,SO(CKS/X)/STOCKINGS/HOSE,22,EARRINGS,15,GLOVES/MITTENS,12
5,NAME SOMETHING YOU PUT WHIPPED CREAM ON,96,82,123,PIE/* PIE,40,CAKE/* CAKE,34,ICECREAM/* ICE+CREAM/SUNDAE,28,PUDDING/* PUDDING/JELL-O,17,STRAWBERRY,10
4,NAME THE MONTH PEOPLE START WEARING SUMMER CLOTHES,99,54,81,MAY,26,JUNe,23,APR[IL],18,JULy,13
5,NAME AN APPLIANCE YOU TRY TO FIX YOURSELF WHEN IT BREAKS DOWN,78,58,87,TOASTER,28,VACUUM,25,WASHER/WASHING+MACHINE,22,BLENDER/MIXER,16,CAN+OPENER,12
7,NAME A COMMON FIRST NAME FOR A WOMAN,75,54,81,MARY,26,ANN,23,LINDA,20,SUSAN,17,JANE,14,BETTY,11,DEBBIE,8
7,NAME SOMETHING YOU BUY IN A CELLOPHANE BAG,75,60,90,CHIPS,29,BREAD,26,CANDY,23,COOKIES,20,PASTA/NOODLES/MACARONI/SPAGHETTI,17,CARROTS,11,POTATOES,8
5,NAME SOMETHING IN A LADY'S PURSE,73,46,69,LIPSTICK,22,COMPACT,19,MONEY,16,WALLET,13,MIRROR,10
4,NAME SOMETHING YOU TASTE FOR A LONG TIME AFTER EATING IT,80,42,63,ONIONS,20,GARLIC,17,CUCUMBERS,14,CHILI,11
5,NAME AN ANIMAL THAT PERFORMS,92,46,69,DOG,22,ELEPHANT,19,SEAL,16,BEAR,13,MONKEY,10
6,NAME SOMETHING A GARDENER DOES,97,72,108,WEED,35,MOW+LAWN/CUT+GRASS,32,[PLANT+]FLOWERS,24,HOES/DIGS,17,TRIMS/PRUNES,13,WATERS,9
5,NAME A COURSE IN A FULL-COURSE MEAL,100,46,69,ENTREE,22,SALAD,19,DESSERT,16,SOUP,13,APPETIZER,10
5,NAME SOMETHING WE GET FROM THE SUN,95,50,75,SUNTAN/SUNBURN,24,HEAT/WARMTH,20,LIGHT,16,ENERGY,13,VITAMINS,10
4,NAME A POPULAR COLOR FOR SOCKS,99,42,63,WHITE,20,BLACK,17,BLUE,14,BROWN,11
4,NAME SOMETHING A DOG DOES TO TELL YOU HOW HE FEELS,90,74,111,WAGS+[HIS+/ITS+]TAIL,36,BARKS,17,WHINES,14,LICKS,11
5,NAME SOMETHING YOU'D SEE IN AN AIRPLANE,75,78,117,STEWARDESS/ATTENDANTS/CREW,38,SEATS,33,(NO+SMOKING/SEAT+BELT)+SIGN,30,PILOT,13,PASSENGERS,10
4,"NAME A STATE WITH ""NEW"" IN ITS NAME",100,68,102,NEW+YORK/NY,33,NEW+HAMP[SHIRE],27,NEW+MEXICO,18,NEW+JERSEY,13
5,NAME THE ROOM IN YOUR HOUSE THAT IS MOST IN NEED OF REDECORATING,97,56,84,KITCHEN,27,LIVING+ROOM,24,BEDROOM,19,BATHROOM,16,DEN/FAMILY+ROOM,13
4,NAME THE MONTH WHEN YOU RECEIVE YOUR TAX REFUND,95,54,81,APR[IL],26,MAR[CH],21,MAY,16,JUNe,13
4,NAME SOMETHING CARS HAVE TWO OF,89,50,75,HEADLIGHTS,24,DOORS,21,[WINDSHIELD+]WIPERS,18,SEATS,11
5,NAME AN AIRLINE,88,56,84,UNITED,27,AMERICAN,24,TWA/TRANS+WORLD,21,DELTA,15,PAN+AN,12
5,NAME THE MOST COMMON FOOD AT A PICNIC,95,80,120,[FRIED+]CHICKEN,39,POT[ATO]+SALAD,32,HOT+DOGS/FRANK[FURTER]S,23,SANDWICH,15,[HAM]BURGERS,12
4,NAME A FRUIT YOU EAT WITH BREAKFAST,95,42,63,BANANAS,20,GRAPEFRUIT,17,ORANGES,14,STRAWBERRY,11
6,NAME SOMETHING FOUND IN A JUNGLE,95,52,78,LIONS,25,MONKEYS/APES,22,TIGERS,18,SNAKES,15,TREES,12,VINES,9
5,NAME A FABRIC EVENING GOWNS ARE MADE OF,95,46,69,SILK,22,SATIN,19,TAFFETA,16,CHIFFON,13,VELVET,10
4,NAME A PLACE WHERE PEOPLE EAT PEANUTS,94,56,84,[BASE]BALL+PARK/STADIUM,27,CIRCUS,17,ZOO,14,BAR,11
3,NAME THE MOST USEFUL SCHOOL SUBJECT,95,40,60,MATH/ARITHMETIC,19,ENGLISH,15,READING,12
3,NAME A FRUIT THAT SQUIRTS,93,38,57,ORANGE,18,GRAPEFRUIT,15,LEMONS,12
6,NAME SOMETHING THAT GOES WELL WITH A FRANKFURTER,90,64,96,MUSTARD,31,BEANS,28,SAUERKRAUT,25,BUN,22,[FRENCH+]FRIES/CHIPS,19,(KETCH/CATS)UP,11
4,NAME A CREAM PIE,93,42,63,BANANA,20,CHOCOLATE,17,COCONUT,14,BOSTON,11
4,NAME THE MONTH WHEN YOU START LOOKING FORWARD TO SPRING,95,58,87,FEB[RUARY],28,JAN[UARY],23,MAR[CH],18,APR[IL],13
5,NAME A KIND OF BREAD,84,54,81,RYE,26,[WHOLE+]WHEAT,23,FRENCH,16,WHITE,13,SOURDOUGH,10
4,NAME A MONTH OF THE FOOTBALL SEASON,87,58,87,NOV[EMBER],28,OCT[OBER],23,DEC[EMBER],18,SEP[TEMBER],13
3,NAME SOMETHING WATER-SKIERS WEAR,95,56,84,SKIS,27,LIFE+(JACKET/PRESERVER),24,SWIMSUIT/BATHING+SUIT,15
5,WHAT ARTICLE OF CLOTHING DO WOMEN SAY THEY OWN THE MOST OF,93,54,81,BLOUSES/SHIRTS,26,PANTS/JEANS/SLACKS,22,UNDERWEAR/LINGERIE,17,SHOES,13,DRESSES,10
6,NAME A LETTER MANY WORDS BEGIN WITH,90,50,75,S,24,T,21,M,18,A,15,B,12,R,9
6,NAME SOMETHING PEOPLE DO WHEN THE SUN GOES DOWN,82,144,216,[TURN]+LIGHTS+ON/TURN+ON+LIGHTS,71,SLEEP,47,WATCH+(TV/TELEVISION),44,GO+(INDOORS/INSIDE),35,EAT+(DINNER/SUPPER),26,[GO+TO+]MOVIES,17
4,NAME SOMETHING YOU DO TO YOUR FINGERNAILS,93,48,72,FILE,23,POLISH/PAINT,20,BITE,16,CUT/TRIM/CLIP,13
3,NAME A BOOK THAT IS IN JUST ABOUT EVERY HOUSEHOLD,94,44,66,BIBLE/* BIBLE,21,COOKBOOK,15,DICTIONARY,12
4,NAME A PART OF A CHICKEN,96,42,63,LEG,20,BREAST,17,WING,14,THIGH,11
4,NAME A GREEN VEGETABLE,70,56,84,PEAS,27,[GREEN+/STRING+]BEANS,24,SPINACH,14,BROCCOLI,11
4,NAME AN ANIMAL THAT CAN KILL A MAN,97,42,63,LION,20,BEAR,17,TIGER,14,SHARK,11
5,NAME SOMETHING YOU CARVE,98,56,84,TURKEY,27,WOOD,24,CHOCOLATE/SWEETS,21,ROAST/* ROAST/MEAT,17,PUMPKIN,10
5,NAME SOMETHING YOU DO WHILE DRIVING,92,66,99,(PLAY+/LISTEN+TO+)RADIO,32,SING,19,TALK,16,EAT,13,SMOKE,10
5,NAME SOMETHING PEOPLE DO ON VACATION,75,62,93,SWIM,30,SIGHTSEE,27,RELAX,24,SUNBATHE,21,TAKE+[PHOTOS/PICTURES],18
4,NAME SOMETHING YOU CLIMB,92,46,69,MOUNTAIN/HILL,22,TREE,18,STAIRS/STEPS,15,LADDER,11
5,BESIDES APPLES NAME ANY FRUIT,82,46,69,ORANGE,22,BANANA,19,PEACH,16,PEAR,13,PLUM,10
5,NAME A MONTH OF THE BASEBALL SEASON,91,62,93,JUNe,30,MAY,25,JULy,22,APR[IL],17,OCT[OBER],12
4,BESIDES A BIRTHDAY CARD NAME A KIND OF GREETING CARD,83,56,84,(CHRIST/X+)MAS,27,ANNIVERSARY,20,GET+WELL,17,SYMPATHY/CONDOLENCE,12
5,NAME AN INDIAN TRIBE,88,48,72,SIOUX/SUE,23,NAVAJO,19,CHEROKEE,16,APACHE,13,BLACKFOOT,10
3,NAME SOMETHING THAT CLIMBS A TREE,94,38,57,CAT,18,MONKEY,15,SQUIRREL,12
6,NAME AN UGLY BIRD,76,58,87,VULTURE,28,OSTRICH,25,PELICAN,22,CROW,19,EMU,16,[SEA+]GULL,13
2,NAME A SPORT IN WHICH GLOVES ARE WORN,82,36,54,BOXING,17,BASEBALL/SOFTBALL,14
3,NAME A DESSERT ON ALMOST EVERY RESTAURANT MENU,98,42,63,PIE,20,ICE+CREAM,17,CAKE,12
4,NAME ANY KIND OF CHAIR,88,64,96,ROCKER/ROCKING+CHAIR,31,EASY[+CHAIR],25,LOUNGE,18,HIGH[+CHAIR],15
3,NAME A FOOD YOU EAT BY THE HANDFUL,96,46,69,POPCORN,22,NUTS,19,[POTATO+]CHIPS,16
6,NAME AN EXPENSIVE HOBBY,60,60,90,SAILING/BOATING,29,FLYING,25,SKIING,22,COINS,19,GOLF,16,[CLASSIC+]CARS,13
12,NAME A FOOD THAT KEEPS A LONG TIME,69,80,120,CHEESE,39,EGGS,36,PICKLES,33,PEANUT+BTR/PEANUT+BUTTER,30,SUGAR,22,BUTTER,19,CARROTS,16,RICE,13,BEANS,10,CEREAL,7,FLOUR,4
9,ON A SCALE OF 1 TO 10 HOW MUCH DID YOU LIKE SCHOOL,97,-1,-1,5,30,8,27,10,24,7,21,9,18,6,15,1,12,3,9,2,6
3,NAME THE SUNNIEST MONTH,98,50,75,JULy,24,AUG[UST],19,JUNe,14
9,NAME SOMETHING A FORGETFUL PERSON MIGHT GO TO WORK WITHOUT,94,80,120,BRIEFCASE/ATTACHE[+CASE],39,LUNCH,31,WALLET/BILLFOLD,28,KEYS,24,PURSE/POCKETBOOK/HANDBAG,21,GLASSES,16,WATCH,13,HANKY/HANDKERCHIEF,10,MONEY,6
2,NAME A PART OF THE BODY YOU BRUSH,98,36,54,HAIR/HEAD,17,TEETH,13
3,NAME A FAMOUS CANAL,100,38,57,PANAMA,18,ERIE,15,SUEZ,12
12,NAME A SPORTS CAR,91,84,126,PORSCHE,41,[COR]VET[TE],38,JAGUAR,29,TRIUMPH,26,MG,23,FERRARI,20,FIAT,17,DATSUN/NISSAN,14,CAMARO,10,FIREBIRD,7,MASERATI,4
3,NAME SOMETHING THAT'S GOOD FOR YOUR LAWN,97,42,63,FERTILIZER/MANURE,20,WATER/RAIN,16,MULCH,12
11,NAME SOMETHING YOU BUY BY THE SET,90,152,228,DISHES/CHINA,75,[GOLF+]CLUBS,71,SILVERWARE/FLATWARE,64,SALT+PEPPER[+SHAKERS],60,TV[+SET]/TELEVISION,47,GLASSES/(SUN/EYE)GLASSES,39,EARrINGS,33,SHOES,28,PENS/PENCILS,25,TIRES,21,WED[DING]+(RINGS/BANDS),18
11,NAME SOMETHING YOU FIND AT THE BOTTOM OF A DESK DRAWER,91,92,138,PAPER+CLIPS,45,PENCILS/PEN,40,PAPER,36,MONEY/COINS,33,RUBBER+BANDS,29,DIRT,24,LETTERS,21,[UNPAID+]BILLS,18,LINT,11,PICTURES/PHOTOS,8,RULER,4
4,NAME A COMMON COLOR FOR BATH TOWELS,92,42,63,BLUE,20,WHITE,17,BROWN,14,YELLOW,11
3,WHO WAS THE FIRST PERSON YOU TOLD WHEN YOU BECAME ENGAGED,93,50,75,PARENTS/MOTHER/FATHER,24,[BEST+]FRIEND,19,SISTER,12
6,NAME A TROPICAL FRUIT,95,50,75,PINEAPPLE,24,KIWI,21,PAPAYA,18,BANANA,15,MANGO,12,COCONUT,9
5,NAME SOMETHING FOUND IN A HOSPITAL,74,48,72,BEDS,23,NURSES,20,DOCTORS/PHYSICIANS,17,BEDPANS,13,NEEDLES,10
5,NAME A WORD IN WEATHER REPORTS,74,46,69,SUNNY,22,RAIN,19,FAIR,16,CLOUDY,13,TEMPERATURE,10
5,NAME A CUT OF STEAK YOU ORDER IN A RESTAURANT,98,94,141,T+BONE,46,FILET[+MIGNON],41,RIB[+STEAK],34,NEW+YORK[ STRIP][ STEAK],27,SIRLOIN,10
3,NAME A PART OF A CAR OPERATED BY YOUR FOOT,99,48,72,GAS[+PEDAL]/ACCELERATOR,23,BRAKE,15,CLUTCH,12
4,NAME THE COLDEST ROOM IN YOUR HOUSE,85,50,75,BEDROOMS,24,BATHROOM,21,BASEMENT,18,LIVING[+ROOM],15
4,NAME SOMETHING THAT MIGHT BE CUSTOM BUILT LOWER IN A SHORT PERSON'S HOUSE,88,42,63,CABINETS,20,COUNTERS,17,SINK,14,TOILET,11
5,NAME AN ANIMAL WITH PAWS,98,46,69,DOG,22,CAT,19,BEAR,16,LION,13,TIGER,10
3,NAME A MUSICAL INSTRUMENT WHICH NEEDS FREQUENT TUNING,98,38,57,GUITAR,18,PIANO,15,VIOLIN,12
4,NAME A PART OF A SHIRT,92,42,63,COLLAR,20,SLEEVE,17,POCKET,14,CUFF,11
4,NAME A POPULAR COLOR FOR WALLPAPER,86,44,66,BLUE,21,BEIGE/TAN,18,YELLOW,14,WHITE,11
6,NAME SOMETHING WITH NUMBERS ON IT,64,62,93,CLOCK,30,TELEPHONE,27,LIC[ENSE]+PLATE,24,CALENDAR,15,CALCULATOR,12,WATCH,9
4,NAME THE MONTH YOU START CHRISTMAS SHOPPING,94,58,87,NOV[EMBER],28,OCT[OBER],23,SEP[TEMBER],18,DEC[EMBER],13
4,NAME AN UGLY CITY,58,52,78,NEW+YORK/NYc,25,CHICAGO,17,PITTSBURGH,14,DETROIT,11
7,NAME SOMETHING YOU SQUEEZE,81,76,114,LEMON,37,ORANGE,34,SPONGE,31,SPOUSE/SWEETHEART/MATE/WIFE/HUSBAND,28,TOILET+PAPER/CHARMIN,21,RUBBER+BALL,15,TOOTH+PASTE,10
3,NAME THE MONTH WHEN PEOPLE START USING THEIR FIREPLACES,98,50,75,OCT[OBER],24,NOV[EMBER],19,DEC[EMBER],14
