3,NAME SOMETHING A FLASHY PERSON OWNS THAT MAKES HIM LOOK FLASHY,94,44,66,CAR/AUTO*,21,CLOTHES,15,JEWELRY,12
5,NAME SOMETHING ON WHICH PEOPLE ACCIDENTALLY BUMP THEIR HEADS,92,76,114,DOORs,37,CABINETs/CUPBOARDs,32,LIGHTs,24,WALLs,19,[CAR+]TRUNK,14
6,NAME SOMETHING PEOPLE MISTAKE FOR UFO'S,94,68,102,SATELLITE/[WEATHER+]BALLOON,33,[AIR]PLANE/HELICOPTER,25,METEOR/STAR,19,COMET,15,LIGHTS,12,CLOUDS,9
4,"NAME SOMETHING THAT PEOPLE SAY THEY'RE ""AS HAPPY AS""",88,70,105,[A+]LARK,34,CAN+BE,27,[A+]CLAM,22,[A+]CLOWN,15
6,"NAME SOMETHING PEOPLE ""BLOW OUT""",97,78,117,[BIRTHDAY+]CANDLES,38,TIRES,31,AIR,28,MATCHES,25,FUSES,22,[THEIR+]NOSEs,19
5,NAME A CAREER FOR A GOOD LIAR,93,60,90,SALESMAN,29,POLITICIAN,26,LAWYER/ATTORNEY,23,ACTOR,19,POLICE*/DETECTIVE/SPY/AGENT/COP,16
11,NAME A VEGETABLE YOU MARINATE,96,126,189,BEANs/* BEANs,62,CUCUMBERs/PICKLEs,50,CARROTs,42,MUSHROOMs,37,ARTICHOKEs,32,ONIONs,27,POTATO[ES],22,TOMATO[ES],17,CAULIFLOWER,12,BEETs,9,BROCCOLI,4
4,NAME A COUNTRY KNOWN FOR ITS BEAUTIFUL WOMEN,91,50,75,SWEDEN,24,FRANCE,21,USA/UNITED+STATES/AMERICA,18,ITALY,11
4,NAME SOMETHING BESIDES HATS THAT PEOPLE HANG ON A HAT STAND,99,64,96,COATs/JACKETs,31,UMBRELLAs,23,SCAR(F/VES),18,TIEs,13
5,NAME AN OCCUPATION WHOSE MEMBERS ARE OFTEN PHOTOGRAPHED,92,64,96,MODELING,31,ACT(ING/ORS),28,POLITIC[IAN]S,23,SPORTS/ATHLET(IC/E)S,18,POLICE[MEN],12
4,NAME A FOOD SOME PEOPLE LIKE WITH OR WITHOUT SUGAR,90,50,75,CEREAL,24,COFFEE,21,GRAPEFRUIT,18,[ICED+]TEA,15
6,NAME A SPOOKY SOUND,90,106,159,CREAK*/SQUEAK*,52,BOO,44,WIND/* WIND,41,OWL+HOOT/HOOooo,35,SCREAM/YELL,15,HOWL[ING],11
5,NAME SOMETHING THAT INSECURE PEOPLE ARE INSECURE ABOUT,78,56,84,APPEARANCE/LOOKS,27,JOB/* JOB/WORK,23,MONEY,16,LOVE,13,MARRIAGE,10
8,NAME SOMETHING THAT KIDS HAVE A FAVORITE ONE OF,87,112,168,TOY/STUFFED+ANIMAL/DOLL/TEDDY*+BEAR,55,TV+(SHOW/PROGRAM)/TELEVISION,41,FOOD/DESSERT,31,BLANKET,27,FRIEND,24,RELATIVE/AUNT/UNCLE/GRAND(+PARENT/MA/PA),21,COLOR,10,TEACHER,7
4,NAME A SOUND THAT CAN LULL YOU TO SLEEP,83,50,75,MUSIC/RADIO,24,RAIN,20,OCEAN/SURF/WAVES,17,CLOCK/TICK,12
8,NAME SOMETHING FOUND ON A GOLF COURSE,92,124,186,GRASS/GREENs,61,TEEs,55,HOLEs,50,SAND+TRAPs,45,GOLF+BALLs,36,FLAGs,27,[GOLF+]CARTs,22,GOLFERs,9
8,NAME THE AGE MEN START GOING GRAY,92,-1,-1,40,28,45,25,35,22,50,19,55,16,30,13,48,10,52,7
7,NAME SOMETHING YOU BUY PICKLED,100,96,144,BEETs,47,PIGs+FEET,42,HERRINGs,33,CUCUMBERs/PICKLEs,28,EGGs,20,ONIONs,15,CAULIFLOWERs,10
7,NAME A KITCHEN APPLIANCE,95,70,105,STOVE/MICROWAVE/RANGE/OVEN,34,TOASTER,28,MIXER/BLENDER,25,CAN+OPENER,21,FRIDGE/REFRIGERATOR/ICEBOX,16,DISHWASHER,11,COFFEEPOT,8
6,NAME A STATE WHICH HAS AVALANCHES,97,62,93,COLORADO/CO,30,CALIFORNIA/CA,26,ALASKA/AK,22,UTAH/UT,18,WASHINGTON/WA,14,WYOMING/WY,10
12,APPROXIMATELY HOW MUCH DOES A NEW TV SET COST,94,-1,-1,500,34,600,31,400,28,450,25,300,22,700,19,350,16,800,13,200,10,395,7,650,4
10,NAME SOMETHING PEOPLE SWING,92,148,222,BATs/BASEBALL,73,SWINGs/PEOPLE,67,ARMs,61,[GOLF+]CLUBs,56,AXEs,43,HIPs,38,(PURSE/BAG/POCKET+BOOK)s,33,KEYs,17,LEGs,12,ROPEs,7
12,NAME THE AGE IN YEARS WHEN GIRLS LEARN TO DANCE,100,-1,-1,12,34,13,31,10,28,14,25,8,22,15,19,5,16,6,13,7,10,9,7,11,4
6,NAME A FOREIGN HAT,100,52,78,BERET,25,SOMBRERO/MEXICAN,22,TURBAN,18,DERBY,15,FEZ,12,PANAMA,9
6,NAME A TYPE OF MUFFIN,97,54,81,BLUEBERRY,26,ENGLISH,23,BRAN,20,CORN,17,EGG+MCMUFFIN,14,BLACKBERRY,9
7,NAME THE MONTH WITH THE BEST WEATHER,100,78,117,JUNe,38,JULy,33,MAY,28,AUG[UST],25,SEP[TEMBER],20,APR[IL],15,OCT[OBER],10
6,NAME AN OCCASION FOR A BIG PARTY,97,78,117,BIRTHDAY,38,NEW+YEARS[+EVE],35,WEDDING,22,ANNIVERSARY,19,(CHRIST/X+)MAS,16,GRADUATION,9
4,NAME SOMETHING THAT HAS A CAPTAIN,100,70,105,SHIP/BOAT/YA[CH]T,34,[SPORTs+]TEAM,27,[AIR]PLANE,16,ARMY,11
6,NAME SOMETHING PEOPLE KEEP IN OR BEHIND THEIR CAR'S SUN VISOR,92,68,102,MIRROR,33,GLASSES/[* ]GLASSES,30,REGIST[RATION],22,MAP,17,CIGARETTES,14,PEN[CIL],11
5,NAME A NATIONALLY KNOWN NEWSPAPER COLUMNIST,85,104,156,[DEAR+]ABBY/ABIGAIL+VAN+BUREN,51,ANN+LANDERS,37,[J[ACK]+]ANDERSON,32,[ERMA+]BOMBECK,21,[ART+]BUCHWALD,14
7,NAME SOMETHING PEOPLE HAVE TROUBLE GETTING OUT OF,73,74,111,[SMALL+]CAR,36,BED,29,DEBT/BILLS,26,LIES/FIBS,22,JAIL/PRISON,18,TROUBLE,14,BATH[TUB]/TUB,11
5,NAME SOMETHING BESIDES A STOVE THAT PEOPLE BURN THEMSELVES ON,78,50,75,IRON,24,MATCHES,21,CIGARETTES,18,HEATER/FURNACE,15,POTS/PANS,11
5,"NAME A PLACE WHERE YOU'D ASK A STRANGER TO ""SAVE YOUR PLACE""",43,60,90,BUS,29,[BALL+]GAME/SPORT/ARENA,26,AIRPORT,17,MOVIE/THEATER,14,CHURCH,10
5,NAME SOMETHING A SON BORROWS FROM HIS FATHER BEFORE AN IMPORTANT DATE,100,84,126,CAR/* CAR,41,MONEY/CASH,35,COLOGNE/AFTERSHAVE,31,RAZOR/[* ](RAZOR/SHAVER),27,TIE/* TIE,13
6,NAME A CAR THAT REALLY SAVES GAS,91,64,96,VOLKSWAGEN/VW,31,HONDA,27,DATSUN,24,TOYOTA,21,CHEVETTE,18,ELECT[RIC]+CAR,15
6,"NAME A FAMOUS PERSON WHOSE LAST NAME IS ""WILLIAMS""",91,50,75,ANDY,24,ROBIN,21,PAUL,18,TENNESSEE,15,HANK,12,CINDY,9
5,NAME A FAMOUS SKYSCRAPER,98,136,204,EMPIRE+STATE,67,SEARS+TOWER,62,WORLD+TRADE[+CENTER],57,[J[OHN]+]HANCOCK[ *],44,EIFFEL TWR/EIFFEL+TOWER,13
5,NAME THE ROOM OF THE HOUSE WHERE MOST FAMILY PROBLEMS ARE DISCUSSED,100,58,87,KITCHEN,28,FAMILY+ROOM,25,LIVING+ROOM,20,DINING+ROOM,15,BEDROOM,10
5,NAME SOMETHING THAT'S HARD TO STOP DOING ONCE YOU START,97,72,108,SMOKING,35,EATING,32,BITING+[FINGER]NAILS/[FINGER]NAIL+BITING,29,GAMBLING,13,DRINKING,10
6,NAME SOMETHING THAT'S DANGEROUS TO KEEP AROUND THE HOUSE,94,62,93,GUNS,30,GASOLINE/GAS,27,POISON/INSECTICIDE,23,THINNER/SOLVENT/PAINT,19,MATCHES,14,OILY+RAGS,11
5,NAME A FLASHY COLOR,94,84,126,RED,41,[HOT+/FLuOREScENT+]PINK,38,ORANGE,16,PURPLE,13,SILVER,10
6,NAME SOMETHING BUSINESS PARTNERS SHARE,89,98,147,PROFITS/INCOME/MONEY,48,[AN/THE]+OFFICE,43,[A/THE]+SECRETARY,31,EXPENSES/BILLS/DEBTS,19,OWNERSHIP/STOCK,14,PROBLEMS/TROUBLE,10
5,NAME SOMETHING THAT YOU HAVE TO MAKE SURE DOESN'T FREEZE IN THE WINTER,96,80,120,[WATER+]PIPES,39,RADIATOR/* RADIATOR/CAR[+WATER],32,PLANTS/VEGETABLES,21,YOURSELF,17,GAS[+TANK],14
5,NAME SOMETHING THAT TOURISTS WANDER AROUND LOOKING FOR,83,76,114,(REST/BATH)ROOMs,37,GIFTS/SOUVENIRS/PRESENTS,28,LANDMARKS/MONUMENT,23,RESTAuRANTS/EAT/FOOD,19,(H/M)OTEL,12
5,NAME SOMETHING YOU SEE OUTSIDE A SCHOOL,93,96,144,FLAG,47,PLAYGROUND/EQUIPMENT,44,KIDS/CHILDREN,40,[ATHLETIC/PLAY[ING]]+FIELD,36,[SCHOOL+]BUS[ES],20
6,NAME SOMETHING YOU KEEP NEAR THE BED WHEN YOU'RE SICK,92,90,135,TISSUES/KLEENEX,44,WATER/* WATER/LIQUIDS/DRINK/JUICE,40,MEDIC(ATION/INE)/PILLS,31,BUCKET/BASIN/PAIL/BEDPAN,25,THERMOMETER,19,WASTE+BASKET/(TRASH+/GARBAGE)CAN,16
5,NAME A SMELL ASSOCIATED WITH CAMPING IN THE WOODS,98,58,87,FIRE/SMOKE,28,EVERGREENS/TREE/PINE,24,COOKING/FOOD,19,FRESH+AIR,15,SKUNK,10
3,NAME A FRUIT PEOPLE BUY FROZEN,97,38,57,STRAWBERRY,18,BLUEBERRY,15,PEACHES,12
5,"NAME A PIECE OF CLOTHING MADE IN A ""ONE SIZE FITS ALL"" SIZE",75,60,90,PANTYHOSE/STOCKINGS,29,SO(CKS/X),25,GLOVES/MITTENS,20,[BATH]ROBE,16,CAP/HAT,11
6,NAME THE STATE IN WHICH YOU THINK IT'S THE EASIEST TO FIND A JOB,74,70,105,CAL[IFORNIA]/CA,34,NEW+YORK/NY,28,ALASKA/AK,22,TEXAS/TX,18,FLORIDA/FL,14,ILLINOIS/IL,10
3,NAME A MUSICAL INSTRUMENT THAT NEEDS FREQUENT TUNING,98,38,57,GUITAR,18,PIANO,15,VIOLIN,12
6,NAME A CITY IN TEXAS,93,58,87,DALLAS,28,HOUSTON,25,SAN+ANTONIO,22,AUSTIN,17,EL+PASO,14,ABILENE,9
6,NAME A DESSERT MOTHERS MAKE,96,76,114,CAKE/* CAKE,37,GELATIN/JELLO,31,PIE/* PIE,27,PUDDING/* PUDDING,21,BROWNIES,15,COOKIES/* COOKIES,12
8,NAME A STATE WHERE COTTON IS GROWN,97,98,147,ALABAMA/AL,48,GEORGIA/GA,44,MISSISSIPPI/MS,40,LOUISIANA/LA,36,S[OUTH]+CAROLINA/SC,32,TEXAS/TX,22,CALIFORNIA/CA,18,N[ORTH]+CAROLINA/NC,14
7,NAME AN ANIMAL KIDS PRETEND TO BE,98,54,81,DOG,26,HORSE,23,CAT,20,LION,17,RABBIT,14,BEAR,11,MONKEY,8
5,NAME A MAGAZINE WITH JOKES IN IT,91,74,111,PLAYBOY,36,MAD,33,READERS+DIGEST,30,NEW+YORKER,25,NAT([']L/IONAL)+LAMPOON,20
12,NAME THE AGE WHEN PEOPLE START ACTING LIKE GROWN-UPS,98,-1,-1,16,34,18,31,21,28,25,25,17,22,20,19,15,16,30,13,14,10,13,7,19,4
5,NAME A COMMON COLOR FOR GLOVES,100,52,78,BROWN,25,BLACK,22,WHITE,19,BEIGE/TAN,16,GR(A/E)Y,12
6,HOW LONG IN MINUTES DOES A WEDDING CEREMONY LAST,97,-1,-1,30,24,60,21,15,18,20,15,10,12,45,9
8,NAME A SUMMER FRUIT,93,58,87,WATERMELON,28,PEACH,25,APPLE,22,STRAWBERRY,19,CANTALOUPE,16,ORANGE,13,CHERRY,10,PEAR,7
9,NAME A FRUIT USED IN CAKE,99,62,93,PINEAPPLE,30,CHERRY,27,APPLE,24,STRAWBERRY,21,BANANA,18,LEMON,15,ORANGE,12,RAISIN,9,PEACH,6
9,NAME SOMETHING YOU PUT ON A HAMBURGER,100,66,99,(CATS/KETCH)UP,32,ONION,27,MUSTARD,24,PICKLE,21,CHEESE,18,RELISH,15,BUN,12,LETTUCE,9,TOMATO,6
7,NAME SOMETHING YOU LIGHT WITH A MATCH,98,54,81,CIGARETTE,26,CANDLE,23,FIRE,20,CIGAR,17,STOVE,14,LANTERN,11,PIPE,8
7,NAME A SPORT WITH SCREAMING FANS,97,54,81,FOOTBALL,26,BASEBALL,23,HOCKEY,20,BASKETBALL,17,BOXING,14,WRESTLING,11,SOCCER,8
7,NAME A SPORT THAT USES A SMALL BALL,99,68,102,GOLF,33,BASEBALL,30,PING+PONG/TABLE+TENNIS,27,TENNIS,19,HANDBALL,16,PADDLEBALL,13,RAC(QU/K)ETBALL,10
4,NAME SOMETHING A BURGLAR FORCES OPEN,99,44,66,WINDOW,21,DOOR,18,SAFE/VAULT,15,LOCK,11
6,ON A SCALE OF 1 TO 10 HOW MUCH DO YOU LIKE YOURSELF,97,-1,-1,8,24,9,21,10,18,7,15,5,12,6,9
10,HOW MANY TIMES HAVE YOU STARTED A DIET THIS YEAR,94,-1,-1,2,32,3,29,0,26,1,23,10,20,4,17,5,14,6,11,12,8,20,5
6,NAME A NON-COLA FLAVOR OF SODA POP,99,74,111,LEMON+LIME/LIME/SEVEN+UP,36,ORANGE,27,GRAPE,24,STRAWBERRY,21,(ROOT/BIRCH)+BEER,18,CHERRY,9
8,HOW MANY TIMES DOES A PERSON CHANGE HIS RESIDENCE,96,-1,-1,5,28,3,25,4,22,10,19,7,16,2,13,6,10,12,7
8,NAME SOMETHING COLORED ORANGE,94,66,99,ORANGE,32,PUMPKIN,29,SUN,26,TANGERINE,23,CARROT,20,[FALL+]LEAVES,17,BASKETBALL,10,CRAYON,7
5,NAME SOMETHING YOU MIGHT RUN OUT TO BUY FIRST THING IN THE MORNING,90,62,93,MILK,30,NEWSPAPER/PAPER,27,COFFEE,23,DO[UGH]NUTS,20,OR+JUICE/ORANGE+JUICE,15
5,NAME SOMETHING THAT'S USUALLY MORE EXPENSIVE THE LARGER IT IS,95,70,105,JEWELRY/DIAMOND,34,HOUSE/HOME,30,CAR/AUTO*,26,TV[+SET]/TELEVISION,20,BOAT/SHIP/YACHT,12
5,NAME A BRAND OF SOFT DRINKS,94,64,96,COCA+COLA/COKE,31,PEPSI+COLA,25,DR+PEPPER,20,SEVEN+UP,15,SHASTA,10
7,NAME SOMETHING WOMEN WEAR IN THEIR HAIR,97,66,99,HAIR+PINS/BOBBYPIN,32,BARRETTE,26,RIBBON,23,CURLERS/ROLLERS,20,BOW,16,CLIPS,13,HAIR+NET,10
4,NAME A BRIGHT COLOR,96,42,63,RED,20,YELLOW,17,ORANGE,14,PINK,11
7,APPROXIMATELY HOW MANY DOLLARS DOES ONE BAG OF GROCERIES COST,97,-1,-1,20,26,15,23,25,20,10,17,30,14,40,11,50,8
5,NAME A CHILD'S FAVORITE DRINK,97,70,105,SODA+POP/POP,34,KOOL+AID,28,MILK,23,[FRUIT+]PUNCH,20,JUICE/* JUICE,13
6,NAME SOMETHING A BARBER USES,96,80,120,SCISSORs/SHEaRs,39,RAZOR,27,COMB,24,CLIPPERS,21,(SHAVE/SHAVING)+CREAM,18,TONIC,9
7,NAME A BRAND OF GASOLINE,95,60,90,SHELL,29,TEXACO,26,EXXON/EXON/ESSO,23,CHEVRON/STANDARD,18,MOBIL,14,ARCO,11,GULF,8
5,NAME A COMMON COLOR FOR HATS,97,50,75,BROWN,24,BLACK,21,GR(A/E)Y,18,BLUE,13,WHITE,10
10,"NAME THE AGE WHEN YOUR ""YOUTH"" ENDS",92,-1,-1,21,32,30,29,25,26,40,23,18,20,20,17,19,14,50,11,16,8,35,5
8,NAME A VEGETABLE YOU CHOP,97,60,90,ONIONS/SCALLIONS,29,CELERY,25,CARROTS,22,CABBAGE,19,BROCCOLI,16,LETTUCE,13,PEPPERS,10,SPINACH,7
7,NAME THE MOST DIFFICULT AGE FOR A GIRL,97,-1,-1,13,26,15,23,16,20,14,17,12,14,17,11,11,8
4,NAME A FORM OF TRANSPORTATION USED ON ICE OR SNOW,97,54,81,SLED/SLEIGH/SLEY,26,SNOW+MOBILE,21,SKIS,16,ICE+SKATES,13
6,NAME SOMETHING PEOPLE CARRY IN THEIR HANDS AS THEY BOARD AIRPLANES,90,98,147,TICKET/BOARDING+PASS,48,LUGGAGE/BAGGAGE/CARRY+ON+BAG/SUITCASE,42,BOOK/MAGAZINE/NEWSPAPER/READ[ING+MATERIAL],30,PURSE/POCKETBOOK/[HAND]BAG,20,COAT/JACKET,13,CAMERA,9
6,ON A SCALE OF 1 TO 10 HOW MUCH DO PEOPLE LIKE BEING MARRIED,97,-1,-1,10,24,8,21,9,18,7,15,5,12,1,9
6,NAME A COLOR OF THE RAINBOW,96,52,78,BLUE,25,RED,22,YELLOW,19,ORANGE,16,GREEN,13,PURPLE/VIOLET,10
8,HOW MANY PAIRS OF JEANS DO YOU HAVE,94,-1,-1,3,28,4,25,5,22,2,19,0,16,1,13,6,10,10,7
7,NAME SOMETHING THAT OFTEN GETS UNFASTENED,93,70,105,ZIPPER/PANTS/FLY,34,BRA,29,BUTTONS,26,SHOELACE,23,BELT+BUCKLE,20,SNAPS,15,NECKLACE/JEWELRY/BRACeLET,12
7,APPROXIMATELY HOW MANY PHONE CALLS DO YOU MAKE PER DAY,98,-1,-1,3,26,5,23,2,20,1,17,4,14,6,11,10,8
7,NAME A BREED OF DOG WITH FLOPPY EARS,92,92,138,BASSET[+HOUND],45,BEAGLE,38,[COCKER+]SPANIEL,35,DACHSHUND,28,POODLE/* POODLE,25,S[AIN]T+BERNARD,19,SHEEP+DOG,10
6,NAME A BRAND OF DEODORANT SOAP,100,66,99,DIAL,32,COAST,29,IRISH+SPR[ING],26,LIFEBuOY,17,SAFEGUARD,12,ZEST,9
6,NAME SOMETHING FOUND IN MOVIE THEATERS,96,62,93,POPCORN,30,SCREEN,27,SEATS,24,SNACK+BAR,21,USHER,16,[MOVIE+]PROJECTOR,13
7,"NAME A SPORT WHERE PEOPLE SAY ""GOOD SHOT""",98,56,84,GOLF,27,BASKETBALL,24,HOCKEY,21,POOL/BILLIARDS,18,TENNIS,14,DARTS,11,BOWLING,8
6,NAME A ZOO ANIMAL THAT PEOPLE LIKE TO FEED,99,56,84,MONKEY/APE/CHIMP/GORILLA,27,ELEPHANT,21,BEAR,18,SEAL,15,DEER,12,GIRAFFE,9
9,NAME A FOOD KEPT REFRIGERATED,99,72,108,MILK,35,MEAT,32,CHEESE,29,ICE+CREAM,26,EGGS,21,BUTTER,18,GELATIN/JELLO,15,MAYO[NNAISE],11,POTATO SALAD,6
4,NAME A STATE THAT GROWS LOTS OF FRUIT,100,50,75,CALIFORNIA/CA,24,FLORIDA/FL,20,HAWAII/HI,16,WASHINGTON/WA,12
9,"HOW MANY MILES PER GALLON DOES AN ""ECONOMY CAR"" GET",91,-1,-1,30,30,25,27,35,24,40,21,32,18,20,15,28,12,50,9,45,6
8,AFTER HOW MANY YEARS OF MARRIAGE DO COUPLES USUALLY GET DIVORCED,97,-1,-1,5,28,10,25,3,22,7,19,2,16,20,13,15,10,1,7
5,NAME SOMETHING THAT BAD DRIVERS ARE ALWAYS BUMPING INTO,98,108,162,[OTHER+](CARS/AUTO*),53,CURBs,34,POLES/* POLES,29,GARAGE[+DOORs],23,MAILBOX[ES],12
8,NAME A QUIET ANIMAL,96,58,87,MOUSE,28,RABBIT,25,CAT,22,DEER,19,TURTLE,16,FISH,13,GIRAFFE,10,HAMSTER,7
6,NAME A PART OF THE BODY PEOPLE WEAR JEWELRY ON,100,50,75,FINGER,24,NECK,21,WRIST,18,EAR,15,ANKLE,12,NOSE,9
8,NAME THE HOUR AT WHICH YOU GET DRESSED ON WEEKENDS,95,-1,-1,10,28,9,25,8,22,12,19,11,16,7,13,1,10,2,7
7,NAME SOMETHING MADE OF LEATHER,99,66,99,BELT,32,SHOES,29,PURSE/POCKETBOOK/[HAND]BAG,26,WALLET/BILLFOLD,19,COAT/JACKET,15,BOOTS,11,GLOVES,8
9,NAME A BIRD RECOGNIZED BY ITS COLOR,94,62,93,BLUEJAY,30,CARDINAL,27,BLUEBIRD,24,ROBIN,21,PEACOCK,18,BLACKBIRD,15,PARAKEET,12,PARROT,9,REDBIRD,6
7,HOW MANY MINUTES DO YOU BOIL PASTA,91,-1,-1,10,26,5,23,7,20,8,17,12,14,20,11,15,8
8,NAME A RECORD COMPANY,91,60,90,CAPITOL,29,RCA,26,COLUMBIA,23,MCA,20,APPLE,17,ATLANTIC,14,ELEKTRA/ASYLUM,11,MOTOWN,7
7,NAME AN ANIMAL THAT'S LARGER THAN A PERSON,95,56,84,ELEPHANT,27,HORSE,24,BEAR,21,APE/GORILLA,18,GIRAFFE,14,WHALE,11,COW,8
7,NAME A STATE WITH FAMOUS COLLEGES,93,80,120,CALIFORNIA/CA,39,MASS[ACHUSETTS]/MA,35,NEW+YORK/NY,29,PENN[SYLVANIA]/PA,23,TEXAS/TX,17,VIRGINIA/VA,13,INDIANA/IN,9
5,NAME SOMETHING A BABY USES,94,46,69,DIAPERS,22,BOTTLE,19,PACIFIER,16,RATTLE,13,CRIB,10
11,NAME SOMETHING THAT HARDENS AS IT COOLS,95,82,123,GELATIN/JELLO,40,CANDY,36,WATER,33,PUDDING/* PUDDING,30,FROSTING/ICING,24,METAL,20,CEMENT/CONCRETE,17,COOKIES,13,LAVA,10,TAR,7,WAX,4
7,NAME A CITY OFTEN SEEN IN MOVIES,95,88,132,NEW+YORK/NYc,43,LOS+ANGELES/LA,35,FRISCO/SAN+FRAN[CISCO],29,LONDON,19,PARIS,16,CHICAGO,13,LAS+VEGAS,10
7,NAME THE AGE WHEN WOMEN START LYING ABOUT THEIR AGE,97,-1,-1,40,26,30,23,35,20,39,17,29,14,50,11,25,8
5,NAME A METAL POTS AND PANS ARE MADE OF,98,48,72,ALUMINUM,23,STEEL/STAINLESS,20,COPPER,16,IRON,13,TEFLON,10
6,NAME A TOY WITH WHEELS,100,54,81,TRUCK,26,WAGON,23,CAR,20,TRICYCLE/TRIKE,17,BICYCLE/BIKE,13,TRAIN,9
8,NAME A DOOR YOU OPEN OFTEN,97,66,99,FRIDGE/REFRIGERATOR/ICEBOX,32,FRONT,27,BATHROOM,24,CAR,21,GARAGE,18,CLOSET,15,CUPBOARD/CABINET/PANTRY,12,KITCHEN,7
7,NAME A TICKLISH SPOT ON PEOPLE,99,62,93,FEET/TOES,30,RIBS,26,UNDER+ARMS/ARMPIT,23,STOMACH,17,EARS,14,NECK,11,NOSE,8
8,HOW MANY TIMES DO SMOKERS TRY TO QUIT SMOKING BEFORE THEY SUCCEED,91,-1,-1,3,28,5,25,10,22,2,19,1,16,4,13,15,10,25,7
8,NAME A FOOD THAT TASTES BETTER WITH BUTTER,97,66,99,BREAD/TOAST,32,CORN,28,POTATOES,25,ROLLS,22,LOBSTER,19,BAGEL,16,GRITS,13,MUFFINS/* MUFFINS,10
7,"NAME A MAN'S FIRST NAME THAT BEGINS WITH THE LETTER ""J""",91,56,84,JOHN,27,JAMES,24,JACK,21,JOSEPH/JOE,18,JAY,14,JASON,11,JEFFREY,8
8,NAME A TOOL EVERYONE USES,96,62,93,HAMMER,30,SCREWDRIVER,27,CAN+OPENER,24,FORK,19,KNIFE,16,SAW,13,PENCIL,10,WRENCH,7
4,NAME A COLOR IN FIRE,98,42,63,RED,20,ORANGE,17,YELLOW,14,BLUE,11
6,NAME AN OCCUPATION IN WHICH YOU RISK YOUR LIFE,86,84,126,POLICE+WORK/LAW/COP/OFFICER,41,FIRE(+FIGHTER/MAN),33,STUNT(+WORK/MAN),26,PILOT/* PILOT,19,SOLDIER,13,BUILDER/CONSTRUCTION,10
5,NAME SOMEONE WHO USES A WAND,98,60,90,MAGICIAN,29,FAIRY[+GODMOTHER],26,CONDUCTOR/MAESTRO/BANDLEADER,19,WITCH,14,WIZARD/SORCERER,11
11,NAME A LIVING THING THAT SCARES PEOPLE,94,78,117,SNAKE,38,SPIDER,35,LION,32,DOG,29,SHARK,26,TIGER,23,RAT,20,MICE/MOUSE,17,BIGFOOT,13,BURGLAR/ROBBER/THIEF/CROOK,10,WOLF,4
5,"WHAT IS ANOTHER WORD FOR ""FRIEND""",96,50,75,PAL,24,BUDDY,21,AMIGO,18,ACQUAINT[ANCE],15,COMPANION,10
6,NAME A BOARD GAME WITH COMPLICATED RULES,95,50,75,CHESS,24,MONOPOLY,21,BACKGAMMON,18,RISK,15,LIFE,12,SCRABBLE,9
6,NAME SOMETHING THAT COMES FROM A MINE,98,50,75,COAL,24,GOLD,21,SILVER,18,DIAMONDS,15,IRON,12,TIN,9
9,NAME THE AGE AT WHICH YOU WOULD LIKE TO RETIRE,91,-1,-1,50,30,55,27,60,24,65,21,45,18,70,15,75,12,35,9,63,6
9,NAME AN ARTICLE OF CLOTHING COLORED BLACK,87,76,114,SO(CKS/X),37,SHOES,32,PANTS/SLACKS/TROUSERS,29,DRESS,24,SUIT/TUXEDO,21,SWEATER,17,BELT,14,COAT/JACKET,11,GLOVES/MITTENS,7
7,NAME A DIVE IN A SWIM MEET,100,76,114,SWAN+DIVE,37,JACK+KNIFE,32,GAINER,27,BACK+FLIP,24,HIGH+DIVE,19,FREE+STYLE,14,SWIRL/TWIST,9
4,NAME A COLOR OF TOOTHPASTE,99,42,63,WHITE,20,BLUE,17,GREEN,14,RED,11
7,HOW LONG IN WEEKS DOES IT TAKE TO LOSE 10 POUNDS,95,-1,-1,4,26,2,23,8,20,3,17,12,14,1,11,24,8
6,NAME THE DESSERT YOU MOST OFTEN SERVE WHEN YOU HAVE COMPANY,97,74,111,CAKE/* CAKE,36,PIE/* PIE,30,ICE+CREAM,24,GELATIN/JELLO,19,FRUIT,15,MOUSSE/* MOUSSE,12
6,NAME AN AUTUMN COLOR,99,50,75,ORANGE,24,BROWN,21,GOLD,18,RED,15,RUST,12,YELLOW,9
7,NAME AN ANIMAL THAT BIG GAME HUNTERS HUNT,98,54,81,LION,26,ELEPHANT,23,DEER,20,BEAR,17,TIGER,14,MOOSE,11,ELK,8
5,NAME THE NOISIEST ROOM IN YOUR HOUSE,100,100,150,KITCHEN,49,(FAMILY/TV/TELEVISION)+ROOM/DEN,46,LIVING+ROOM,33,(PLAY/KIDS/CHILD[REN])+ROOM,28,BED+ROOM,12
6,NAME SOMETHING MADE WITH COCONUT,99,90,135,PIE,44,CAKEs,41,DRINKS,36,CANDY,33,COOKIEs/MACAROONS,30,TAN[NING]+(LOTION/OIL)/OIL,24
6,NAME A BRAND OF CAMERA,100,50,75,KODAK,24,CANON,21,POLAROID,18,MINOLTA,15,PENTAX,12,NIKON,9
5,NAME A TYPE OF SLIPPER,95,48,72,BEDROOM/HOUSE,23,GLASS,19,BALLET,16,MOCCASIN,13,SATIN,10
5,NAME A PLACE WHERE YOU'RE PARTICULARLY BOTHERED BY PEOPLE WHO SMOKE,80,56,84,RESTAURANT,27,CAR/AUTO*,24,[AIR]PLANE,18,ELEVATOR,13,BAR,10
4,NAME A COLOR WORN BY BUSINESS EXECUTIVES,100,56,84,GR(A/E)Y,27,BLUE/NAVY[+BLUE],22,BROWN,14,BLACK,11
6,NAME A BODY PART THAT TENSES WHEN YOU'RE NERVOUS,98,56,84,NECK/THROAT/SHOULDER,27,HEAD,22,STOMACH,19,HANDS,16,BACK,13,LEGS/KNEES,10
6,NAME THE BEST COLOR FOR A CAR INTERIOR,100,54,81,BLUE/NAVY,26,BEIGE/TAN,22,BLACK,18,BROWN,15,RED,12,WHITE,9
6,HOW MANY HOURS CAN YOU SPEND SHOPPING BEFORE YOU GET TIRED,94,-1,-1,2,24,3,21,4,18,1,15,5,12,6,9
5,NAME A FRUIT-FLAVORED ICE CREAM,99,50,75,STRAWBERRY,24,PEACH,21,CHERRY,18,TUTTI+FRUTTI,15,ORANGE,10
4,NAME A PET BIRD KEPT IN A CAGE,99,42,63,CANARY,20,PARROT,17,PARAKEET,14,MYNA,11
5,NAME SOMETHING AN AIRPLANE NEEDS TO FLY,99,52,78,WINGS,25,FUEL/GAS,22,ENGINE/MOTOR/JET,18,PILOT,13,PROPELLER,10
7,NAME A FRUIT USED IN MAKING DAIQUIRIS,98,54,81,STRAWBERRY,26,BANANA,23,LIME,20,CHERRY,17,LEMON,14,PINEAPPLE,11,ORANGE,8
5,NAME AMERICA'S FAVORITE VACATION SPOT,99,56,84,FLORIDA/FL,27,CALIFORNIA/CA,23,HAWAII/HI,19,COLORADO/CO,15,TEXAS/TX,11
3,NAME A PRESIDENT KNOWN BY HIS INITIALS,98,38,57,JFK,18,FDR,15,LBJ,12
9,HOW MUCH IN DOLLARS DOES A MARRIAGE LICENSE COST,94,-1,-1,5,30,10,27,3,24,2,21,6,18,12,15,15,12,7,9,20,6
8,NAME A JOB IN A RESTAURANT,97,98,147,WAIT(RESS/ER),48,COOK/CHEF,43,BUS+BOY,39,HOSTESS,34,CASHIER,31,MAiT(RE/ER)+D,28,DISHWASHER,11,MANAGER/OWNER,8
5,NAME THE BODY PART THAT GETS THE COLDEST WHEN YOU'RE OUTSIDE,98,52,78,FACE/NOSE,25,FEET/TOES,21,HANDS/FINGERS,17,EARS,13,LEGS,10
5,NAME THE BEVERAGE YOU DRINK MOST,92,64,96,SODA[+POP]/POP,31,COFFEE,23,WATER,20,MILK,17,[ICED+]TEA,14
7,NAME A LENS COLOR IN SUNGLASSES,98,62,93,GREEN,30,BROWN,27,GR(A/E)Y/SMOKE,24,BLUE,18,BLACK,15,YELLOW,12,PINK/ROSE,9
5,NAME THE AILMENT PEOPLE SAY THEY HAVE WHEN THEY CALL IN SICK TO WORK,97,50,75,FLU,24,COLD,21,HEADACHE,18,VIRUS,15,SORE+THROAT,12
6,NAME A COLOR OF FLOWERS IN HAWAII,100,54,81,PINK,26,RED,23,YELLOW,20,WHITE,17,PURPLE/LAVENDER/ORCHID,14,ORANGE,9
7,NAME SOMETHING USED TO APPLY MAKE-UP,99,74,111,BRUSH,36,POWDER+PUFF,33,FINGERS/HAND,28,COTTON[+BALLS],24,MIRROR,17,SPONGE,14,PENCIL/* PENCIL,11
6,NAME A PIECE OF CLOTHING WORN OVER OTHER CLOTHES,96,58,87,COAT/JACKET,28,SWEATER,24,BLOUSE/SHIRT,21,VEST,17,PANTS/TROUSERS/SLACKS,14,DRESS,9
8,NAME THE AVERAGE WEIGHT IN POUNDS PEOPLE LOSE ON A SUCCESSFUL DIET,97,-1,-1,20,28,10,25,25,22,15,19,5,16,30,13,40,10,50,7
6,NAME A VEGETABLE YOU BUTTER,96,50,75,CORN,24,POTATOES,21,PEAS,18,BEANS,15,BROCCOLI,12,ARTICHOKES,9
5,NAME A PART OF YOUR BODY THAT HELPS YOU KEEP YOUR BALANCE,97,52,78,FEET/TOES,25,ARMS,21,INNER+EAR,18,LEGS,13,BRAIN,10
4,NAME A PART OF THE SCHOOL DAY,96,46,69,RECESS,22,LUNCH,19,HOMEROOM,16,STUDY+HALL,13
9,NAME A SUMMER VACATION STATE,94,80,120,FLORIDA/FL,39,CALIFORNIA/CA,35,HAWAII/HI,31,MAINE/ME,27,VERMONT/VT,23,COLORADO/CO,19,MICHIGAN/MI,15,WISCONSIN/WI,11,ALASKA/AK,7
9,"NAME A TYPE OF PRODUCT ADVERTISED AS ""HEAVY DUTY""",97,120,180,DETERGENTs/CLEANERs,59,TRASH+BAGs/GARBAGE,51,BATTERY,41,[TIN+/ALUMINUM+]FOIL,38,OIL,28,PAPER+TOWELs,25,WASH(ER/ING+MACHINE),16,SOAP,9,TIRES,6
8,AT WHAT AGE DO MOST PEOPLE BECOME COMPLETELY SELF-SUPPORTING,95,-1,-1,21,28,25,25,22,22,20,19,23,16,18,13,24,10,27,7
9,NAME SOMETHING THAT PEOPLE TRY TO KEEP OUT OF THE HOUSE,96,92,138,BUGS/INSECTS,45,MICE/MOUSE,41,DIRT/MUD,37,PETS/DOG/CAT,33,COLD[+AIR],28,BURGLARS/ROBBERS/THIEVES,21,GUNS,16,RATS,13,SALES(M(E/A)N/PEOPLE),10
6,NEXT TO WATER WHAT IS THE WORLD'S MOST POPULAR BEVERAGE,100,68,102,SODA[+POP]/POP,33,BEER,25,MILK,22,COFFEE,19,[ICED+]TEA,16,WINE,9
6,IN ONE WORD DESCRIBE THE STREETS OF NEW YORK,94,56,84,CROWDED,27,BUSY,24,DANGEROUS/UNSAFE,21,DIRTY,17,CRAZY/WILD,14,NOISY/LOUD,10
5,NAME SOMETHING YOU GET INTO AND OUT OF EVERY DAY,99,68,102,BED,33,CLOTHES,30,CAR/AUTO*,27,SHOWER/BATH*/[BATH]TUB,21,HO(USE/ME),12
4,NAME A PLACE IN THE HOME WHERE MANY PEOPLE LEAVE A LIGHT ON ALL NIGHT,96,42,63,BATHROOM,20,HALLWAY,17,KITCHEN,14,BEDROOM,11
3,NAME SOMETHING THAT COMES IN A CARTON,94,38,57,MILK,18,EGGS,15,CIGARETTES,12
5,NAME SOMETHING PEOPLE WAX,95,50,75,CAR,24,FLOORS,21,FURNITURE,18,SKIS,15,MoUSTACHE,12
6,IF A TEENAGER HAD SOME EXTRA MONEY WHAT WOULD HE SPEND IT ON,90,58,87,RECORDS/TAPES/CDS,28,CLOTHES,23,CAR,20,FOOD,17,VIDEO+GAMES,14,MOVIES,9
5,"NAME A CHARACTER IN THE ""PEANUTS"" COMIC STRIP BESIDES CHARLIE BROWN",94,72,108,SNOOPY,35,LUCY,32,LINUS,29,P'MINT PATTY/P[EPPER]MINT+PATTY,26,ScHROeDER,16
4,NAME A FAMOUS ROCK,92,42,63,GIBRALTAR,20,PLYMOUTH,17,HUDSON,14,PET,11
4,NAME SOMETHING ASSOCIATED WITH ATLANTIC CITY,94,58,87,CASINO/GAMBLING,28,BOARDWALK,24,MISS+AMER[ICA]/PAGEANT,21,OCEAN,11
7,NAME A FAMOUS SHIP REAL OR FICTIONAL,80,70,105,TITANIC,34,MAYFLOWER,31,QUEEN+MARY,28,LOVE+BOAT/PACIFIC PRINCESS,23,IRONSIDES/CONSTITUTION,17,SANTA+MARIA,13,BOUNTY,8
8,NAME A MAGAZINE YOU TRUST,74,102,153,TIME,50,READ DIG/READERS+DIGEST,47,NEWSWEEK,41,GOOD+HOUSE/GOOD+HOUSEKEEPING,38,LIFE,30,PEOPLE,27,NAT(IONA/')L+GEOG[RAPHIC],24,PARENTS,7
3,"NAME SOMETHING CHILDREN ARE TOLD THEY ARE ""NOT OLD ENOUGH"" TO DO",50,60,90,DRIVE,29,STAY+UP[+LATE]/LATE,26,DATE,12
7,NAME SOMETHING THAT'S BLACK AND WHITE,90,68,102,NEWSPAPER,33,ZEBRA,30,SKUNK,27,TV[+SET]/TELEVISION,24,POLICE+CAR,16,CAT,11,PENGUIN,8
4,NAME SOMETHING WITH A PROPELLER,100,50,75,[AIR]PLANE,24,HELICOPTER,19,BOAT/SHIP,16,BEANIE/CAP,12
6,NAME A SOUVENIR PEOPLE BRING BACK FROM HAWAII,93,66,99,LEIS/LAYS,32,SHIRT,28,PINEAPPLE,25,(GRASS/HULA)+SKIRT,22,MACADAMIAS/NUTS,13,SHELLS,9
7,NAME SOMETHING THAT CHANGES FROM GREEN TO YELLOW,96,76,114,LEAVES/LEAF,37,TRAF[FIC]+LIGHT,33,BANANA,24,[DYING+]GRASS,21,APPLE,14,SQUASH,11,LEMON,8
5,NAME A FAMOUS PIRATE REAL OR FICTIONAL,96,74,111,CAPT+HOOK,36,BLACKBEARD,31,BLUEBEARD,28,LONG+JOHN[+SILVER],25,CAPT+KIDD,12
5,NAME SOMETHING CHILDREN LOVE TO RIDE ON,95,96,144,BIKES/TRIKES/BICYCLE/TRICYCLE,47,HORSES/PONY,41,CAROUSEL/MERRY+GO+ROUND,37,SHOULDERS,27,ROLL[ER]+COAST[ER],24
4,NAME AN ELECTRICAL APPLIANCE USED IN THE BATHROOM,99,62,93,[HAIR+/BLOW+]DRYER,30,RAZOR,20,CURLING+IRON/CURLER,17,HEATER,11
6,NAME SOMETHING THAT COOLS YOU OFF IN HOT WEATHER,91,76,114,AIR+COND[ITIONING]/AC,37,ICED+TEA,27,COLD+SHOWER/BATH,22,SWIMMING/POOL,16,FAN,12,LEMONADE,9
6,NAME A GAME PEOPLE GAMBLE AT IN LAS VEGAS,100,56,84,BLACKJACK/TWENTY+ONE,27,CRAPS,21,POKER,18,ROULETTE,15,SLOTS,12,KENO,9
4,NAME A REASON WHY PEOPLE MIGHT LEAVE THEIR SEATS DURING AN INTERMISSION,98,44,66,RESTROOM/BATHROOM,21,EAT,17,DRINK,14,SMOKE,11
8,NAME A CITY ASSOCIATED WITH SPY MOVIES,87,76,114,LONDON,37,PARIS,34,NEW+YORK/NYc,31,MOSCOW,23,WASHINGTON/DC,20,BERLIN,16,ROME,13,FRISCO/SAN+FRANCISCO,10
6,NAME SOMETHING YOU DO WHEN YOU CAN'T SLEEP,92,142,213,READ[+A][+BOOK]/READ,70,WATCH+(TV/TELEVISION),50,COUNT+SHEEP,41,EAT,36,DRINK+[WARM+]MILK,33,TOSS & TURN/TOSS+[AND+]TURN,20
7,NAME SOMETHING HUSBANDS DO THAT ANNOYS THEIR WIVES,70,198,297,LEAVE MESS/LEAVE+*+MESS,98,IGNORE+THEM,80,[COME/GET]+HOME+LATE,75,[WATCH+]TV/[TOO+MUCH]+TV,51,SNORE,33,DRINK[+TOO+MUCH],30,[PLAY+](POKER/CARDS)/GAMBLE,19
5,NAME SOMETHING ASSOCIATED WITH GEORGE WASHINGTON,85,116,174,CHERRY+TREE/(CUT/CHOP)+CHERRY+TREE,57,DOLLAR+BILL,37,(WOODEN/FALSE)+TEETH,32,[CROSS[ING]+]DELAWARE,23,MT+VERNON,12
6,NAME SOMETHING YOU'RE ASKED TO DO AT THE DOCTOR'S,96,142,213,DISROBE/UNDRESS/TAKE+CLOTHES+OFF,70,SAY+AH/OPEN[+MOUTH]+WIDE,59,TAKE+[DEEP+]BREATH,43,COUGH,30,[GET+]WEIGHED/WEIGH,27,[GIVE+](HISTORY/INFO),19
4,NAME A LIQUID YOU PUT IN YOUR CAR,99,50,75,GAS[OLINE],24,OIL,19,WATER,16,ANTI+FREEZE,13
8,NAME SOMETHING FOUND IN HEALTH CLUBS,88,82,123,WEIGHTS/BARBELLS,40,EXERCISE+BIKES/BICYCLES/EXERCYCLES,36,JACUZZI,29,SAUNA,26,[SWIMMING+]POOL,23,SCALES,16,FAT+PEOPLE/OVERWEIGHT,13,SHOWERS,7
